path,text,BASIC_SOUNDS,HESITATION_WORDS,VERBAL_CRUTCHES,REPETITIVE_STARTS,FILLED_PAUSES,DISCOURSE_MARKERS,PERSONAL_PRONOUNS,OPINION_INDICATORS,EMOTION_WORDS,JUDGMENT_ADJECTIVES,QUALIFIERS_HEDGING,COMMON_PHRASES,OPINION_PHRASES,SELF_DISCLOSURES,HEALTH,FINANCES,RELATIONSHIPS,FAMILY,LIMITED_AVAILABILITY,EXCLUSIVITY,TIME_SENSITIVE,LIMITED_TIME,EXCLUSIVE_DISCOUNT,URGENCY_PROMOTION,OTHERS,SELLING_FAST,HARD_WORK,EXCLUSIVE_FOR_FOLLOWERS,GENEROSITY,APPRECIATION,NATURAL_FIT,LIFESTYLE_IMPROVEMENT,CONTINUATION,GOALS,DURATION,UNIQUE_CODE,SHARING_CODE,HONESTY,CONTRAST,PROS,CONS,ADMISSION,UNCERTAINTY,FIRST_PERSON_QUESTIONS,GENERAL_AUDIENCE_QUESTIONS,POV,UNBOXING,GRWM,RESTOCKING,DAY_IN_MY_LIFE_PATTERNS,DUPE,video_duration,end_first_segment,PG_BRAND,COTERIE_BRAND,HEALTHYBABY_BRAND,HONEST_BRAND,HUGGIES_BRAND,KUDOSTOBABY_BRAND,LUVS_BRAND,MYMILLIEMOON_BRAND,PAMPERSUS_BRAND,RASCALSBABY_BRAND,THENINJAMAS_BRAND,GENERAL_HOOK,NEGATIVE_HOOK,brand_counts,BRAND_TS,integration_in_first_10_seconds,integration_in_first_half_video,integration_duration,int_between_90_240,integration_ts,narrative_changes,brand_as_sponsor,scenes,raw_scenes,scene_change_in_integration,num_scenes
results/coterie/C-5_QPIyNVK_2024-08-20_21-17-52_UTC," I just woke my baby up from a four hour nap. So obviously she needs some snuggles and then we're going to change her diaper. We've been using the diaper by Coterie and oh my heck, the softness is like cashmere. It absorbs so dang good. Plus they use clean ingredients, which means reduced skin irritation, which is so important for my eczema prone baby.",True,True,False,True,True,True,True,False,True,True,False,False,False,False,False,False,False,False,False,False,False,False,False,False,False,False,False,False,False,False,False,False,False,False,False,False,False,False,False,False,False,False,False,False,False,False,False,False,False,False,False,18.74,2.42,False,False,False,False,False,False,False,False,False,False,False,False,False,1,7.82,1,0,0.0,0,"(0, 0)",1,0,"[(0.0, 6.567), (6.567, 8.7), (8.7, 15.733), (15.733, 18.633)]","[('00:00:00.000', '00:00:06.567'), ('00:00:06.567', '00:00:08.700'), ('00:00:08.700', '00:00:15.733'), ('00:00:15.733', '00:00:18.633')]",0,4
results/coterie/C-DXZgbOkpL_2024-07-30_15-54-25_UTC_1, Thank you.,False,False,False,False,False,False,False,False,False,False,False,False,False,False,False,False,False,False,False,False,False,False,False,False,False,False,False,False,False,False,False,False,False,False,False,False,False,False,False,False,False,False,False,False,False,False,False,False,False,False,False,13.6,29.98,False,False,False,False,False,False,False,False,False,False,False,False,False,0,0.0,0,0,0.0,0,"(0, 0)",0,0,"[(0.0, 1.736), (1.736, 3.238), (3.238, 5.308), (5.308, 7.277), (7.277, 8.78), (8.78, 10.081), (10.081, 11.383), (11.383, 13.42), (13.42, 13.553)]","[('00:00:00.000', '00:00:01.736'), ('00:00:01.736', '00:00:03.238'), ('00:00:03.238', '00:00:05.308'), ('00:00:05.308', '00:00:07.277'), ('00:00:07.277', '00:00:08.780'), ('00:00:08.780', '00:00:10.081'), ('00:00:10.081', '00:00:11.383'), ('00:00:11.383', '00:00:13.420'), ('00:00:13.420', '00:00:13.553')]",0,9
results/coterie/C-ENTmNu4LL_2024-07-30_23-47-31_UTC_1, Thank you.,False,False,False,False,False,False,False,False,False,False,False,False,False,False,False,False,False,False,False,False,False,False,False,False,False,False,False,False,False,False,False,False,False,False,False,False,False,False,False,False,False,False,False,False,False,False,False,False,False,False,False,13.59,29.98,False,False,False,False,False,False,False,False,False,False,False,False,False,0,0.0,0,0,0.0,0,"(0, 0)",0,0,"[(0.0, 1.736), (1.736, 3.238), (3.238, 5.308), (5.308, 7.277), (7.277, 8.78), (8.78, 10.081), (10.081, 11.383), (11.383, 13.42), (13.42, 13.587)]","[('00:00:00.000', '00:00:01.736'), ('00:00:01.736', '00:00:03.238'), ('00:00:03.238', '00:00:05.308'), ('00:00:05.308', '00:00:07.277'), ('00:00:07.277', '00:00:08.780'), ('00:00:08.780', '00:00:10.081'), ('00:00:10.081', '00:00:11.383'), ('00:00:11.383', '00:00:13.420'), ('00:00:13.420', '00:00:13.587')]",0,9
results/coterie/C-Nbj5Ss_kr_2024-08-03_13-43-16_UTC_1, Thank you. Thank you.,False,False,False,False,False,False,False,False,False,False,False,False,False,False,False,False,False,False,False,False,False,False,False,False,False,False,False,False,False,False,False,False,False,False,False,False,False,False,False,False,False,False,False,False,False,False,False,False,False,False,False,31.02,29.98,False,False,False,False,False,False,False,False,False,False,False,False,False,0,0.0,0,0,0.0,0,"(0, 0)",0,0,"[(0.0, 1.2), (1.2, 1.867), (1.867, 3.2), (3.2, 4.167), (4.167, 5.867), (5.867, 6.3), (6.3, 6.733), (6.733, 7.2), (7.2, 8.5), (8.5, 9.3), (9.3, 9.733), (9.733, 10.267), (10.267, 10.8), (10.8, 11.7), (11.7, 12.333), (12.333, 12.767), (12.767, 13.367), (13.367, 13.967), (13.967, 14.433), (14.433, 15.167), (15.167, 15.733), (15.733, 18.1), (18.1, 19.6), (19.6, 21.467), (21.467, 23.2), (23.2, 24.867), (24.867, 28.5), (28.5, 30.833)]","[('00:00:00.000', '00:00:01.200'), ('00:00:01.200', '00:00:01.867'), ('00:00:01.867', '00:00:03.200'), ('00:00:03.200', '00:00:04.167'), ('00:00:04.167', '00:00:05.867'), ('00:00:05.867', '00:00:06.300'), ('00:00:06.300', '00:00:06.733'), ('00:00:06.733', '00:00:07.200'), ('00:00:07.200', '00:00:08.500'), ('00:00:08.500', '00:00:09.300'), ('00:00:09.300', '00:00:09.733'), ('00:00:09.733', '00:00:10.267'), ('00:00:10.267', '00:00:10.800'), ('00:00:10.800', '00:00:11.700'), ('00:00:11.700', '00:00:12.333'), ('00:00:12.333', '00:00:12.767'), ('00:00:12.767', '00:00:13.367'), ('00:00:13.367', '00:00:13.967'), ('00:00:13.967', '00:00:14.433'), ('00:00:14.433', '00:00:15.167'), ('00:00:15.167', '00:00:15.733'), ('00:00:15.733', '00:00:18.100'), ('00:00:18.100', '00:00:19.600'), ('00:00:19.600', '00:00:21.467'), ('00:00:21.467', '00:00:23.200'), ('00:00:23.200', '00:00:24.867'), ('00:00:24.867', '00:00:28.500'), ('00:00:28.500', '00:00:30.833')]",0,28
results/coterie/C-V6tW3u8fR_2024-08-06_20-54-44_UTC_1, Hey! Hey! Hey! Hey! Hey!,False,False,False,False,False,False,False,False,False,False,False,False,False,False,False,False,False,False,False,False,False,False,False,False,False,False,False,False,False,False,False,False,False,False,False,False,False,False,False,False,False,False,False,False,False,False,False,False,False,False,False,15.48,2.0,False,False,False,False,False,False,False,False,False,False,False,False,False,0,0.0,0,0,0.0,0,"(0, 0)",0,0,"[(0.0, 4.4), (4.4, 7.833), (7.833, 12.3), (12.3, 15.367)]","[('00:00:00.000', '00:00:04.400'), ('00:00:04.400', '00:00:07.833'), ('00:00:07.833', '00:00:12.300'), ('00:00:12.300', '00:00:15.367')]",0,4
results/coterie/C-YbFlAS_Qo_2024-08-07_20-11-12_UTC, spend a weekend morning with us this morning we went to our local farmers market for some goodies for brunch we wanted to make our latest obsession which is some sourdough french toast starting solid the santino has definitely been all the things at first anxiety inducing but then fun and also always a mess you just need a whole lot of patience a cleaning crew close by ours is shila and jitsu of course and the new coterie soft wipe if you know me as a mom you know that i'm a coterie wipe fanatic and now they have their new soft wipe which are also paraben free fragrance free and clean and they're great for messes like this because they're actually moisturizing for the skin after brunch i nursed santino and that was our morning,False,True,True,True,False,True,True,False,True,False,False,False,False,False,True,False,False,False,False,False,False,False,False,False,False,False,False,False,False,False,False,False,False,False,False,False,False,False,False,False,False,False,False,False,False,False,False,False,False,False,False,36.82,4.48,False,False,False,False,False,False,False,False,False,False,False,False,False,2,21.63,0,0,0.0,0,"(0, 0)",1,0,"[(0.0, 0.667), (0.667, 1.4), (1.4, 2.933), (2.933, 3.833), (3.833, 4.733), (4.733, 6.0), (6.0, 6.8), (6.8, 7.567), (7.567, 8.4), (8.4, 10.133), (10.133, 11.067), (11.067, 12.1), (12.1, 12.533), (12.533, 13.167), (13.167, 13.633), (13.633, 14.2), (14.2, 14.633), (14.633, 16.8), (16.8, 18.167), (18.167, 18.8), (18.8, 20.133), (20.133, 21.433), (21.433, 22.1), (22.1, 23.0), (23.0, 24.067), (24.067, 24.9), (24.9, 26.867), (26.867, 30.133), (30.133, 31.733), (31.733, 33.233), (33.233, 34.0), (34.0, 34.767), (34.767, 36.7)]","[('00:00:00.000', '00:00:00.667'), ('00:00:00.667', '00:00:01.400'), ('00:00:01.400', '00:00:02.933'), ('00:00:02.933', '00:00:03.833'), ('00:00:03.833', '00:00:04.733'), ('00:00:04.733', '00:00:06.000'), ('00:00:06.000', '00:00:06.800'), ('00:00:06.800', '00:00:07.567'), ('00:00:07.567', '00:00:08.400'), ('00:00:08.400', '00:00:10.133'), ('00:00:10.133', '00:00:11.067'), ('00:00:11.067', '00:00:12.100'), ('00:00:12.100', '00:00:12.533'), ('00:00:12.533', '00:00:13.167'), ('00:00:13.167', '00:00:13.633'), ('00:00:13.633', '00:00:14.200'), ('00:00:14.200', '00:00:14.633'), ('00:00:14.633', '00:00:16.800'), ('00:00:16.800', '00:00:18.167'), ('00:00:18.167', '00:00:18.800'), ('00:00:18.800', '00:00:20.133'), ('00:00:20.133', '00:00:21.433'), ('00:00:21.433', '00:00:22.100'), ('00:00:22.100', '00:00:23.000'), ('00:00:23.000', '00:00:24.067'), ('00:00:24.067', '00:00:24.900'), ('00:00:24.900', '00:00:26.867'), ('00:00:26.867', '00:00:30.133'), ('00:00:30.133', '00:00:31.733'), ('00:00:31.733', '00:00:33.233'), ('00:00:33.233', '00:00:34.000'), ('00:00:34.000', '00:00:34.767'), ('00:00:34.767', '00:00:36.700')]",0,33
results/coterie/C-sMKNjuCDh_2024-08-15_12-27-50_UTC," Oh, I wasn't sad. I just needed a...",True,True,False,False,True,False,True,False,False,False,False,False,False,False,False,False,False,False,False,False,False,False,False,False,False,False,False,False,False,False,False,False,False,False,False,False,False,False,False,False,False,False,False,False,False,False,False,False,False,False,False,5.94,1.5,False,False,False,False,False,False,False,False,False,False,False,False,False,0,0.0,0,0,0.0,0,"(0, 0)",1,0,"[(0.0, 2.467), (2.467, 3.233), (3.233, 4.6), (4.6, 5.933)]","[('00:00:00.000', '00:00:02.467'), ('00:00:02.467', '00:00:03.233'), ('00:00:03.233', '00:00:04.600'), ('00:00:04.600', '00:00:05.933')]",0,4
results/coterie/C13K-t2oUAQ_2024-01-09_02-03-32_UTC_4_1, Wow!,False,False,False,False,False,False,False,False,False,False,False,False,False,False,False,False,False,False,False,False,False,False,False,False,False,False,False,False,False,False,False,False,False,False,False,False,False,False,False,False,False,False,False,False,False,False,False,False,False,False,False,8.22,4.0,False,False,False,False,False,False,False,False,False,False,False,False,False,0,0.0,0,0,0.0,0,"(0, 0)",0,0,[],[],0,0
results/coterie/C1zxtS8vCE7_2024-01-07_18-26-55_UTC_1," People see me but they just don't know Come on baby, let the good time roll I'm fresh off the block, the hustler just returned Hadibov these niggas, now they call me Big Worm I'm the shit according to the streets The town without gift will make Memphis bleak But I don't toss up rock signs and diamonds But I might toss an heavy head hoe like I'm missing Come on baby, let the good time roll Let's do it",False,True,False,False,False,True,True,False,True,True,False,False,False,False,False,False,False,False,False,False,False,False,False,False,False,False,False,False,False,False,False,False,False,False,False,False,False,False,False,False,False,False,False,False,False,False,False,False,False,False,False,32.16,2.86,False,False,False,False,False,False,False,False,False,False,False,False,True,0,0.0,0,0,0.0,0,"(0, 0)",1,0,[],[],0,0
results/coterie/C2FtxwBRDzg_2024-01-14_17-39-06_UTC_1, Will we stay the same? Do you know what you're doing?,False,False,True,False,False,True,True,False,False,False,False,False,False,False,False,False,False,False,False,False,False,False,False,False,False,False,False,False,False,False,False,False,False,False,False,False,False,False,False,False,False,False,False,False,False,False,False,False,False,False,False,8.17,3.9,False,False,False,False,False,False,False,False,False,False,False,False,False,0,0.0,0,0,0.0,0,"(0, 0)",1,0,"[(0.0, 1.767), (1.767, 2.967), (2.967, 4.0), (4.0, 5.1), (5.1, 6.033), (6.033, 6.7), (6.7, 8.067)]","[('00:00:00.000', '00:00:01.767'), ('00:00:01.767', '00:00:02.967'), ('00:00:02.967', '00:00:04.000'), ('00:00:04.000', '00:00:05.100'), ('00:00:05.100', '00:00:06.033'), ('00:00:06.033', '00:00:06.700'), ('00:00:06.700', '00:00:08.067')]",0,7
results/coterie/C3Fs12rr5TK_2024-02-08_14-00-00_UTC, I feel like it was just yesterday that I was nesting for my baby girl. Now we get to do it all over again with the baby boy and I am so excited to try the coterie diapers with him. I have been seeing these all over the internet and let me tell you the hype is real. They are so soft and free of over 200 chemicals.,False,True,False,False,False,True,True,True,True,False,False,False,False,True,False,False,False,False,False,False,False,False,False,False,False,False,False,False,False,False,False,False,False,False,False,False,False,False,False,False,False,False,False,False,False,False,False,False,False,False,False,23.08,4.7,False,False,False,False,False,False,False,False,False,False,False,False,False,1,8.85,1,0,0.0,0,"(0, 0)",1,0,"[(0.0, 6.6), (6.6, 10.4), (10.4, 11.3), (11.3, 12.133), (12.133, 13.567), (13.567, 14.633), (14.633, 22.967)]","[('00:00:00.000', '00:00:06.600'), ('00:00:06.600', '00:00:10.400'), ('00:00:10.400', '00:00:11.300'), ('00:00:11.300', '00:00:12.133'), ('00:00:12.133', '00:00:13.567'), ('00:00:13.567', '00:00:14.633'), ('00:00:14.633', '00:00:22.967')]",0,7
results/coterie/C3JZ0wivIqb_2024-02-10_00-36-19_UTC," Abraham slowly It loses his breath This læric making fun Guess what? I need to avoid it That's my way, Yumi The way he thinks all about the flow",False,False,False,False,False,False,True,True,False,False,False,False,False,False,False,False,False,False,False,False,False,False,False,False,False,False,False,False,False,False,False,False,False,False,False,False,False,False,False,False,False,False,False,False,False,False,False,False,False,False,False,18.27,2.82,False,False,False,False,False,False,False,False,False,False,False,False,False,0,0.0,0,0,0.0,0,"(0, 0)",1,0,"[(0.0, 1.833), (1.833, 2.4), (2.4, 3.2), (3.2, 3.9), (3.9, 4.5), (4.5, 5.133), (5.133, 14.9), (14.9, 16.133), (16.133, 18.167)]","[('00:00:00.000', '00:00:01.833'), ('00:00:01.833', '00:00:02.400'), ('00:00:02.400', '00:00:03.200'), ('00:00:03.200', '00:00:03.900'), ('00:00:03.900', '00:00:04.500'), ('00:00:04.500', '00:00:05.133'), ('00:00:05.133', '00:00:14.900'), ('00:00:14.900', '00:00:16.133'), ('00:00:16.133', '00:00:18.167')]",0,9
results/coterie/C3UKnCJM20g_2024-02-14_04-57-46_UTC_1," Okay, here's part two of my son's nursery closet transformation. We picked up this over-the-door alpha rack. I don't know if you noticed, but we took out the closet sliding doors because at some point, I'd like to replace them with French doors, so this might end up going over the closet door in the future. Next came the fun part. We picked up some cute and spacious toy bins and beautiful and functional storage bins to organize diapers, outgrown clothes, toys, and books. Tell me you're adulting without telling me. And also, seeing all of this come together is just so satisfying. I just need to remind myself to do this more often in my life in general. Anyway, go check out the container store and see how alpha can transform your life. I mean, your space, especially while it's 30% off.",False,True,True,False,False,True,True,False,True,False,False,False,False,False,False,False,False,True,False,False,False,False,False,False,False,False,False,False,False,False,False,False,False,False,False,False,False,False,False,False,False,False,False,False,False,False,False,False,False,False,False,47.37,4.62,False,False,False,False,False,False,False,False,False,False,False,False,False,0,0.0,0,0,0.0,0,"(0, 0)",1,0,"[(0.0, 6.991), (6.991, 10.755), (10.755, 11.544), (11.544, 26.421), (26.421, 43.379), (43.379, 47.179)]","[('00:00:00.000', '00:00:06.991'), ('00:00:06.991', '00:00:10.755'), ('00:00:10.755', '00:00:11.544'), ('00:00:11.544', '00:00:26.421'), ('00:00:26.421', '00:00:43.379'), ('00:00:43.379', '00:00:47.179')]",0,6
results/coterie/C4n3p9buShE_2024-03-17_17-04-23_UTC, girl is coming any day now so let's set up her dresser with these diapers from coterie these are safer babies at all stages and they are as soft as cashmere they even have a water line and they are 70 more absorbent than any other leading diaper brand after i filled up the nursery i went downstairs and filled up the diaper caddy that i'm gonna have next to my bed for the next couple months i added some swaddles some burp rags butt paste and we can't forget the wipes and don't forget i have a code linked in my bio,False,True,False,False,False,True,True,False,False,False,False,False,False,False,False,False,False,False,False,False,False,False,False,False,False,False,False,False,False,False,False,False,False,False,False,False,False,False,False,False,False,False,False,False,False,False,False,False,False,False,False,21.99,3.84,False,True,False,False,False,False,False,False,False,False,False,False,False,1,1.92,1,1,0.0,0,"(0, 0)",1,0,"[(0.0, 0.633), (0.633, 1.267), (1.267, 1.933), (1.933, 2.667), (2.667, 3.367), (3.367, 3.833), (3.833, 4.433), (4.433, 5.133), (5.133, 5.7), (5.7, 7.133), (7.133, 7.667), (7.667, 8.933), (8.933, 9.633), (9.633, 11.033), (11.033, 11.8), (11.8, 12.467), (12.467, 13.067), (13.067, 13.9), (13.9, 14.533), (14.533, 15.533), (15.533, 16.233), (16.233, 17.233), (17.233, 18.0), (18.0, 18.633), (18.633, 19.3), (19.3, 20.133), (20.133, 21.833)]","[('00:00:00.000', '00:00:00.633'), ('00:00:00.633', '00:00:01.267'), ('00:00:01.267', '00:00:01.933'), ('00:00:01.933', '00:00:02.667'), ('00:00:02.667', '00:00:03.367'), ('00:00:03.367', '00:00:03.833'), ('00:00:03.833', '00:00:04.433'), ('00:00:04.433', '00:00:05.133'), ('00:00:05.133', '00:00:05.700'), ('00:00:05.700', '00:00:07.133'), ('00:00:07.133', '00:00:07.667'), ('00:00:07.667', '00:00:08.933'), ('00:00:08.933', '00:00:09.633'), ('00:00:09.633', '00:00:11.033'), ('00:00:11.033', '00:00:11.800'), ('00:00:11.800', '00:00:12.467'), ('00:00:12.467', '00:00:13.067'), ('00:00:13.067', '00:00:13.900'), ('00:00:13.900', '00:00:14.533'), ('00:00:14.533', '00:00:15.533'), ('00:00:15.533', '00:00:16.233'), ('00:00:16.233', '00:00:17.233'), ('00:00:17.233', '00:00:18.000'), ('00:00:18.000', '00:00:18.633'), ('00:00:18.633', '00:00:19.300'), ('00:00:19.300', '00:00:20.133'), ('00:00:20.133', '00:00:21.833')]",0,27
results/coterie/C50yXdfrqN9_2024-04-16_13-57-06_UTC_1," Here is everything I pack in my diaper bag for a newborn as a third time mom. Starting off with coterie diapers. I recently switched to those because they contain less irritants than the common drugstore brands and they feel super soft on our baby skin. I also use their wipes. We have a changing pad, a nursing cover, and a swaddle blanket just in case. A couple of burp cloths and bibs for spit up. A change of clothes with a cute little hat. I love these booties and some socks. I love this portable sound machine by Hatch. I also use a small pouch and pack a few things for myself like a hand sanitizer, a lotion stain remover. Just some things to have on hand with me. I also make sure to always bring a pacifier. I just have it attached to the side of the diaper bag.",False,True,False,False,False,True,True,True,True,False,False,False,False,False,False,False,False,False,False,False,False,False,False,False,False,False,False,False,False,False,False,False,False,False,False,False,False,False,False,False,False,False,False,False,False,False,False,False,False,False,False,40.66,3.96,False,False,False,False,False,False,False,False,False,False,False,False,False,1,5.06,1,1,0.0,0,"(0, 0)",1,0,"[(0.0, 1.8), (1.8, 3.033), (3.033, 3.633), (3.633, 4.767), (4.767, 7.6), (7.6, 9.567), (9.567, 10.367), (10.367, 11.433), (11.433, 11.967), (11.967, 12.7), (12.7, 13.167), (13.167, 13.733), (13.733, 14.567), (14.567, 15.167), (15.167, 16.0), (16.0, 16.833), (16.833, 17.667), (17.667, 18.133), (18.133, 18.933), (18.933, 20.467), (20.467, 20.967), (20.967, 21.6), (21.6, 22.067), (22.067, 22.833), (22.833, 23.333), (23.333, 23.933), (23.933, 24.467), (24.467, 25.333), (25.333, 25.8), (25.8, 26.733), (26.733, 27.3), (27.3, 28.033), (28.033, 28.833), (28.833, 29.467), (29.467, 30.1), (30.1, 30.633), (30.633, 31.3), (31.3, 31.833), (31.833, 32.467), (32.467, 33.4), (33.4, 33.933), (33.933, 34.633), (34.633, 35.8), (35.8, 36.333), (36.333, 37.267), (37.267, 37.733), (37.733, 38.3), (38.3, 39.033), (39.033, 40.2), (40.2, 40.533)]","[('00:00:00.000', '00:00:01.800'), ('00:00:01.800', '00:00:03.033'), ('00:00:03.033', '00:00:03.633'), ('00:00:03.633', '00:00:04.767'), ('00:00:04.767', '00:00:07.600'), ('00:00:07.600', '00:00:09.567'), ('00:00:09.567', '00:00:10.367'), ('00:00:10.367', '00:00:11.433'), ('00:00:11.433', '00:00:11.967'), ('00:00:11.967', '00:00:12.700'), ('00:00:12.700', '00:00:13.167'), ('00:00:13.167', '00:00:13.733'), ('00:00:13.733', '00:00:14.567'), ('00:00:14.567', '00:00:15.167'), ('00:00:15.167', '00:00:16.000'), ('00:00:16.000', '00:00:16.833'), ('00:00:16.833', '00:00:17.667'), ('00:00:17.667', '00:00:18.133'), ('00:00:18.133', '00:00:18.933'), ('00:00:18.933', '00:00:20.467'), ('00:00:20.467', '00:00:20.967'), ('00:00:20.967', '00:00:21.600'), ('00:00:21.600', '00:00:22.067'), ('00:00:22.067', '00:00:22.833'), ('00:00:22.833', '00:00:23.333'), ('00:00:23.333', '00:00:23.933'), ('00:00:23.933', '00:00:24.467'), ('00:00:24.467', '00:00:25.333'), ('00:00:25.333', '00:00:25.800'), ('00:00:25.800', '00:00:26.733'), ('00:00:26.733', '00:00:27.300'), ('00:00:27.300', '00:00:28.033'), ('00:00:28.033', '00:00:28.833'), ('00:00:28.833', '00:00:29.467'), ('00:00:29.467', '00:00:30.100'), ('00:00:30.100', '00:00:30.633'), ('00:00:30.633', '00:00:31.300'), ('00:00:31.300', '00:00:31.833'), ('00:00:31.833', '00:00:32.467'), ('00:00:32.467', '00:00:33.400'), ('00:00:33.400', '00:00:33.933'), ('00:00:33.933', '00:00:34.633'), ('00:00:34.633', '00:00:35.800'), ('00:00:35.800', '00:00:36.333'), ('00:00:36.333', '00:00:37.267'), ('00:00:37.267', '00:00:37.733'), ('00:00:37.733', '00:00:38.300'), ('00:00:38.300', '00:00:39.033'), ('00:00:39.033', '00:00:40.200'), ('00:00:40.200', '00:00:40.533')]",0,50
results/coterie/C5Ootbmg-Yf_2024-04-01_18-20-58_UTC, 40 days and 40 nights I waited for a girl like you Come and save my life All the days I waited for you You know the ones who said I'd never find someone like you You were out of my league All the things I believed,False,True,True,False,False,True,True,False,True,False,False,False,False,False,False,False,False,False,False,False,False,False,False,False,False,False,False,False,False,False,False,False,False,False,False,False,False,False,False,False,False,False,False,False,False,False,False,False,False,False,False,24.98,3.16,False,False,False,False,False,False,False,False,False,False,False,False,False,0,0.0,0,0,0.0,0,"(0, 0)",1,0,"[(0.0, 0.867), (0.867, 1.667), (1.667, 3.1), (3.1, 5.6), (5.6, 7.433), (7.433, 8.367), (8.367, 9.0), (9.0, 9.8), (9.8, 11.0), (11.0, 11.833), (11.833, 12.533), (12.533, 13.2), (13.2, 13.767), (13.767, 14.533), (14.533, 17.1), (17.1, 17.733), (17.733, 18.333), (18.333, 19.167), (19.167, 19.733), (19.733, 20.233), (20.233, 20.733), (20.733, 21.267), (21.267, 21.833), (21.833, 22.867), (22.867, 24.333), (24.333, 24.867)]","[('00:00:00.000', '00:00:00.867'), ('00:00:00.867', '00:00:01.667'), ('00:00:01.667', '00:00:03.100'), ('00:00:03.100', '00:00:05.600'), ('00:00:05.600', '00:00:07.433'), ('00:00:07.433', '00:00:08.367'), ('00:00:08.367', '00:00:09.000'), ('00:00:09.000', '00:00:09.800'), ('00:00:09.800', '00:00:11.000'), ('00:00:11.000', '00:00:11.833'), ('00:00:11.833', '00:00:12.533'), ('00:00:12.533', '00:00:13.200'), ('00:00:13.200', '00:00:13.767'), ('00:00:13.767', '00:00:14.533'), ('00:00:14.533', '00:00:17.100'), ('00:00:17.100', '00:00:17.733'), ('00:00:17.733', '00:00:18.333'), ('00:00:18.333', '00:00:19.167'), ('00:00:19.167', '00:00:19.733'), ('00:00:19.733', '00:00:20.233'), ('00:00:20.233', '00:00:20.733'), ('00:00:20.733', '00:00:21.267'), ('00:00:21.267', '00:00:21.833'), ('00:00:21.833', '00:00:22.867'), ('00:00:22.867', '00:00:24.333'), ('00:00:24.333', '00:00:24.867')]",0,26
results/coterie/C5j1PoKgShq_2024-04-09_23-53-58_UTC, Thank you. Thank you.,False,False,False,False,False,False,False,False,False,False,False,False,False,False,False,False,False,False,False,False,False,False,False,False,False,False,False,False,False,False,False,False,False,False,False,False,False,False,False,False,False,False,False,False,False,False,False,False,False,False,False,30.69,29.98,False,False,False,False,False,False,False,False,False,False,False,False,False,0,0.0,0,0,0.0,0,"(0, 0)",0,0,"[(0.0, 1.63), (1.63, 5.37), (5.37, 8.556), (8.556, 13.889), (13.889, 15.185), (15.185, 16.63), (16.63, 18.148), (18.148, 22.481), (22.481, 25.407), (25.407, 27.593), (27.593, 28.963), (28.963, 30.63)]","[('00:00:00.000', '00:00:01.630'), ('00:00:01.630', '00:00:05.370'), ('00:00:05.370', '00:00:08.556'), ('00:00:08.556', '00:00:13.889'), ('00:00:13.889', '00:00:15.185'), ('00:00:15.185', '00:00:16.630'), ('00:00:16.630', '00:00:18.148'), ('00:00:18.148', '00:00:22.481'), ('00:00:22.481', '00:00:25.407'), ('00:00:25.407', '00:00:27.593'), ('00:00:27.593', '00:00:28.963'), ('00:00:28.963', '00:00:30.630')]",0,12
