results/pampersus/C80N9R6u1j-_2024-06-29_22-38-52_UTC," are four ways that you can prevent diaper dermatitis in a newborn with a big thank you to Pampers for sponsoring this post. I'm an OB-GYN, so I spend a lot of time with my recently postpartum patients and their babies. I'm also a mom of three, so I've spent a lot of time diapering. Did you know that more than 70% of newborns will develop diaper dermatitis? Here are the four things that you can do to help prevent this. Number one, routinely exposing your baby's bottom to air. Number two, use pH balance wipes to gently tap on their skin instead of pulling across their skin. Number three, use a thick layer of diaper cream. And number four, use super absorbent disposable diapers. Pampers diapers and wipes are designed with seven skin protecting features, including an absorbent core and a barrier ointment. They also have a soft fabric on the outside and the inside to help stop any irritation on all sides of the diaper. There are many reasons why this is the number one choice of hospitals, parents, and nurses. When given so many options for diapers, choose the one that pediatricians have recommended for over 60 years.",False,True,True,False,False,True,True,False,False,False,False,False,False,False,False,False,False,False,False,False,False,False,False,False,False,False,False,False,False,True,False,False,False,False,False,False,False,False,False,False,False,False,False,False,False,False,False,False,False,False,False,54.82,3.2600000000000002,False,False,False,False,False,False,False,False,False,False,False,False,False,0,0.0,0,0,0.0,0,"(0, 0)",1,0,"[(0.0, 5.367), (5.367, 13.5), (13.5, 19.2), (19.2, 22.033), (22.033, 27.767), (27.767, 30.133), (30.133, 33.467), (33.467, 37.133), (37.133, 40.167), (40.167, 45.6), (45.6, 49.4), (49.4, 54.733)]","[('00:00:00.000', '00:00:05.367'), ('00:00:05.367', '00:00:13.500'), ('00:00:13.500', '00:00:19.200'), ('00:00:19.200', '00:00:22.033'), ('00:00:22.033', '00:00:27.767'), ('00:00:27.767', '00:00:30.133'), ('00:00:30.133', '00:00:33.467'), ('00:00:33.467', '00:00:37.133'), ('00:00:37.133', '00:00:40.167'), ('00:00:40.167', '00:00:45.600'), ('00:00:45.600', '00:00:49.400'), ('00:00:49.400', '00:00:54.733')]",0,12
results/pampersus/C813nutxaEr_2024-06-30_13-43-35_UTC_1," Hey Sammy, let's play a game. Hi, the PD Pals here and we're partnering with Pampers to play true or false and bust some diaper myths that we hear all the time as pediatricians. I love it. All right, let's go. True or false? If you said true, you are correct. Pampers diapers and wipes have seven skin protecting features that are designed to mitigate risks caused by diaper dermatitis. So that means that Pampers diapers are soft, gentle, and safe for even the most fragile, delicate newborn skin. Awesome. Now true or false? If you said true, you're correct. Pampers are 100% hypoallergenic and dermatologist approved. Yes, they're free of parabens and latex to be gentle on baby's skin. Okay, one more. Eh, wrong. I know from personal experience that Pampers swaddlers offer up to 100% leak-proof protection, even from blowouts. Exactly. And did you know that Pampers are proven to be three times drier and absorb 50% faster than other brands? Wow. Actually, I'm not surprised. Now I know why Pampers is still the number one recommended diaper brand of pediatricians. And it's why I used it on my kids when they were babies. So this is not the first time, I'm not surprised. So we're buying a lot. And I think I'm good too. It helps me put a lot of та plan. Aww So So I think I'm good",True,True,True,False,True,True,True,True,True,True,False,True,True,False,False,False,False,True,False,False,False,False,False,False,False,False,False,False,False,False,False,False,False,False,False,False,False,False,False,False,False,False,True,False,False,False,False,False,False,False,False,78.48,5.64,False,False,False,False,False,False,False,False,False,False,False,False,False,0,0.0,0,0,0.0,0,"(0, 0)",1,0,"[(0.0, 10.333), (10.333, 16.333), (16.333, 18.267), (18.267, 25.1), (25.1, 32.267), (32.267, 37.033), (37.033, 42.867), (42.867, 47.267), (47.267, 51.133), (51.133, 60.067), (60.067, 67.3), (67.3, 75.033), (75.033, 78.367)]","[('00:00:00.000', '00:00:10.333'), ('00:00:10.333', '00:00:16.333'), ('00:00:16.333', '00:00:18.267'), ('00:00:18.267', '00:00:25.100'), ('00:00:25.100', '00:00:32.267'), ('00:00:32.267', '00:00:37.033'), ('00:00:37.033', '00:00:42.867'), ('00:00:42.867', '00:00:47.267'), ('00:00:47.267', '00:00:51.133'), ('00:00:51.133', '00:01:00.067'), ('00:01:00.067', '00:01:07.300'), ('00:01:07.300', '00:01:15.033'), ('00:01:15.033', '00:01:18.367')]",0,13
results/pampersus/C8247EBuf3Q_2024-06-30_23-09-02_UTC," Shelby, you're telling me it's already time to buy diapers for a baby that hasn't even been born yet? Yes. We got to suck up on up to 100% leak-proof pamper swaddlers. You know how things get with a baby? Ugh. Messy. Don't give me flashbacks. You better flash forward because this is in your near future. Ain't that the truth? Shelby, last time these things were game changers. Yeah, they were. And they're going to be this time too. Our baby's skin is going to be protected. Consider your skin protected. And our house from Bow House. For real, we made the switch pretty early on last time. And after putting the diapers to the test, I may be the smartest parent I know. Okay, deal. I don't think your head can safely get any bigger. Shelby! Time to start stockpiling, I guess.",False,False,True,False,False,True,True,True,False,True,False,False,False,False,False,False,False,False,False,False,False,False,False,False,False,False,False,False,False,False,False,False,False,False,False,False,False,False,False,False,False,False,False,False,False,False,False,False,False,False,False,48.9,4.96,False,False,False,False,False,False,False,False,False,False,False,False,False,0,0.0,0,0,0.0,0,"(0, 0)",1,0,"[(0.0, 5.967), (5.967, 9.833), (9.833, 11.6), (11.6, 15.133), (15.133, 18.8), (18.8, 19.967), (19.967, 22.833), (22.833, 24.433), (24.433, 27.2), (27.2, 29.4), (29.4, 30.733), (30.733, 32.567), (32.567, 36.6), (36.6, 38.467), (38.467, 41.8), (41.8, 43.8), (43.8, 46.967), (46.967, 48.833)]","[('00:00:00.000', '00:00:05.967'), ('00:00:05.967', '00:00:09.833'), ('00:00:09.833', '00:00:11.600'), ('00:00:11.600', '00:00:15.133'), ('00:00:15.133', '00:00:18.800'), ('00:00:18.800', '00:00:19.967'), ('00:00:19.967', '00:00:22.833'), ('00:00:22.833', '00:00:24.433'), ('00:00:24.433', '00:00:27.200'), ('00:00:27.200', '00:00:29.400'), ('00:00:29.400', '00:00:30.733'), ('00:00:30.733', '00:00:32.567'), ('00:00:32.567', '00:00:36.600'), ('00:00:36.600', '00:00:38.467'), ('00:00:38.467', '00:00:41.800'), ('00:00:41.800', '00:00:43.800'), ('00:00:43.800', '00:00:46.967'), ('00:00:46.967', '00:00:48.833')]",0,18
results/pampersus/C83B1EpMdep_2024-07-01_00-23-35_UTC_1," Did you know that 70% of healthy babies experience a diaper rash within the first seven days of life? Shocking, right? And guess what? It's not due to diapers. It's actually caused by other factors such as allergies, antibiotics use, medications, diarrhea, or even changes in diet. That's why I partnered with Pampers to help protect their glittles where they need it the most. Pampers, Swaddlers, Thygris are designed to protect your baby's skin by pulling wetness away from your baby's skin, locking away irritants, offering low friction and breathable materials, and balancing your baby's skin pH. With these skin protective features, your baby's skin is safe and healthy.",False,False,True,False,False,True,True,True,False,False,False,False,False,False,False,False,False,False,False,False,False,False,False,False,False,False,False,False,False,False,False,False,False,False,False,False,False,False,False,False,False,False,False,False,False,False,False,False,False,False,False,44.49,6.12,False,False,False,False,False,False,False,False,False,False,False,False,False,0,0.0,0,0,0.0,0,"(0, 0)",1,0,"[(0.0, 1.9), (1.9, 4.933), (4.933, 10.533), (10.533, 13.133), (13.133, 19.767), (19.767, 21.467), (21.467, 23.967), (23.967, 32.633), (32.633, 36.2), (36.2, 41.067), (41.067, 42.9), (42.9, 44.267)]","[('00:00:00.000', '00:00:01.900'), ('00:00:01.900', '00:00:04.933'), ('00:00:04.933', '00:00:10.533'), ('00:00:10.533', '00:00:13.133'), ('00:00:13.133', '00:00:19.767'), ('00:00:19.767', '00:00:21.467'), ('00:00:21.467', '00:00:23.967'), ('00:00:23.967', '00:00:32.633'), ('00:00:32.633', '00:00:36.200'), ('00:00:36.200', '00:00:41.067'), ('00:00:41.067', '00:00:42.900'), ('00:00:42.900', '00:00:44.267')]",0,12
results/pampersus/C83MZOaxgyB_2024-07-01_01-59-21_UTC," Come with me to restock Accentures at Target. I'm very grateful to be partnering with Pampers for the new free and gentle wipes that have become a go-to for my family, in and out of the house. It's so important to have wipes ready for any mess that may come our way, especially while on the go. I love using Pampers free and gentle wipes because they are 100% plant-based and have zero alcohol, dyes or fragrances. I also love that they are 5 times stronger to help prevent tearing, which is essential when you have little ones that are always on the go. Try these wipes out. It'll be a lot of mess like we do. We'll love to hear how you guys use your wipes on your next adventures. Please share in the comments. See you guys next time.",False,True,False,False,False,True,True,False,True,False,False,False,False,False,False,False,False,False,False,False,False,False,False,False,False,False,False,False,False,False,False,False,False,False,False,False,False,False,False,False,False,False,False,False,False,False,False,False,True,False,False,41.51,2.6,False,False,False,False,False,False,False,False,False,False,False,False,False,0,0.0,0,0,0.0,0,"(0, 0)",1,0,"[(0.0, 3.033), (3.033, 6.533), (6.533, 9.567), (9.567, 10.833), (10.833, 12.133), (12.133, 14.733), (14.733, 16.033), (16.033, 17.0), (17.0, 18.533), (18.533, 20.633), (20.633, 21.633), (21.633, 22.6), (22.6, 24.6), (24.6, 25.6), (25.6, 26.633), (26.633, 28.8), (28.8, 31.367), (31.367, 32.9), (32.9, 33.867), (33.867, 37.133), (37.133, 41.4)]","[('00:00:00.000', '00:00:03.033'), ('00:00:03.033', '00:00:06.533'), ('00:00:06.533', '00:00:09.567'), ('00:00:09.567', '00:00:10.833'), ('00:00:10.833', '00:00:12.133'), ('00:00:12.133', '00:00:14.733'), ('00:00:14.733', '00:00:16.033'), ('00:00:16.033', '00:00:17.000'), ('00:00:17.000', '00:00:18.533'), ('00:00:18.533', '00:00:20.633'), ('00:00:20.633', '00:00:21.633'), ('00:00:21.633', '00:00:22.600'), ('00:00:22.600', '00:00:24.600'), ('00:00:24.600', '00:00:25.600'), ('00:00:25.600', '00:00:26.633'), ('00:00:26.633', '00:00:28.800'), ('00:00:28.800', '00:00:31.367'), ('00:00:31.367', '00:00:32.900'), ('00:00:32.900', '00:00:33.867'), ('00:00:33.867', '00:00:37.133'), ('00:00:37.133', '00:00:41.400')]",0,21
results/pampersus/C85gvKvyYuO_2024-07-01_23-39-27_UTC," Oh, I love you, Miss. And you will be grieved as soon. But I won't be blamed. Cause I love you, Miss. She knows that she...",True,False,False,False,True,False,True,False,True,False,False,False,False,False,False,False,False,False,False,False,False,False,False,False,False,False,False,False,False,False,False,False,False,False,False,False,False,False,False,False,False,False,False,False,False,False,False,False,False,False,False,18.29,2.56,False,False,False,False,False,False,False,False,False,False,False,False,False,0,0.0,0,0,0.0,0,"(0, 0)",1,0,"[(0.0, 0.667), (0.667, 2.3), (2.3, 3.9), (3.9, 5.167), (5.167, 6.2), (6.2, 8.567), (8.567, 9.767), (9.767, 14.7), (14.7, 15.8), (15.8, 18.167)]","[('00:00:00.000', '00:00:00.667'), ('00:00:00.667', '00:00:02.300'), ('00:00:02.300', '00:00:03.900'), ('00:00:03.900', '00:00:05.167'), ('00:00:05.167', '00:00:06.200'), ('00:00:06.200', '00:00:08.567'), ('00:00:08.567', '00:00:09.767'), ('00:00:09.767', '00:00:14.700'), ('00:00:14.700', '00:00:15.800'), ('00:00:15.800', '00:00:18.167')]",0,10
results/pampersus/C8DY6Acto0C_2024-06-10_23-05-02_UTC_1," We used to dread diaper changes because of our wiggly toddler, so we were so excited when Pampers reached out to partner with us. The Swaddler's 360 diaper has been a game changer. Thanks to the Poulon 360 degree stretchy waistband, there is no more wrestling to lay down and makes it so easy to change standing up. For a quick removal, simply rip the easy tear sides and roll the diaper and secure with the disposal tape that comes attached to the back. And you're done. Get your free two-count sample and a $4 offer for your next purchase of a Pampers Swaddler's 360 box mailed directly to your home while supplies last. We can thank Pampers Swaddler's 360 for getting us quickly back to our bonding time as a family.",False,True,False,False,False,True,True,False,False,False,False,False,False,False,False,False,True,False,True,False,False,False,False,False,False,False,False,False,False,False,False,False,False,False,False,False,False,False,False,False,False,False,False,False,False,False,False,False,False,False,False,40.96,6.54,False,False,False,False,False,False,False,False,False,False,False,False,False,0,0.0,0,0,0.0,0,"(0, 0)",1,0,"[(0.0, 1.468), (1.468, 3.003), (3.003, 4.738), (4.738, 6.006), (6.006, 8.208), (8.208, 9.709), (9.709, 11.478), (11.478, 13.279), (13.279, 18.284), (18.284, 19.519), (19.519, 22.388), (22.388, 23.156), (23.156, 25.925), (25.925, 29.862), (29.862, 34.834), (34.834, 38.404), (38.404, 40.906)]","[('00:00:00.000', '00:00:01.468'), ('00:00:01.468', '00:00:03.003'), ('00:00:03.003', '00:00:04.738'), ('00:00:04.738', '00:00:06.006'), ('00:00:06.006', '00:00:08.208'), ('00:00:08.208', '00:00:09.709'), ('00:00:09.709', '00:00:11.478'), ('00:00:11.478', '00:00:13.279'), ('00:00:13.279', '00:00:18.284'), ('00:00:18.284', '00:00:19.519'), ('00:00:19.519', '00:00:22.388'), ('00:00:22.388', '00:00:23.156'), ('00:00:23.156', '00:00:25.925'), ('00:00:25.925', '00:00:29.862'), ('00:00:29.862', '00:00:34.834'), ('00:00:34.834', '00:00:38.404'), ('00:00:38.404', '00:00:40.906')]",0,17
results/pampersus/C8Fg-OnPHPJ_2024-06-11_18-54-23_UTC," Prep with me for potty training brought to you by Pampers Easy Ups and their partnership with Bluey. Being seven months pregnant and taking care of a two-year-old is no joke. With the baby coming soon, I decided to make my life a little bit easier. Potty training can seem really scary. These Pampers Easy Ups are saving my life. They're extremely soft and stretchy and resemble underwear to help with that transition. These are made to be easily pulled on or taken off so your toddler can build that independence. And they're up to 100% leak-proof. So you can rely on them for those overnight accidents. Who wouldn't be excited about Bluey training underwear? For more potty training activities, visit Pampers.com or go to the link in my bio.",False,True,False,False,False,True,True,False,False,False,False,False,False,False,False,False,False,False,False,False,False,False,False,False,False,False,False,False,False,False,False,False,False,False,False,False,False,False,False,False,False,False,False,False,False,False,False,False,False,False,False,28.88,3.3200000000000003,False,False,False,False,False,False,False,False,False,False,False,False,False,0,0.0,0,0,0.0,0,"(0, 0)",1,0,"[(0.0, 3.467), (3.467, 7.667), (7.667, 9.8), (9.8, 11.1), (11.1, 12.0), (12.0, 15.067), (15.067, 17.633), (17.633, 20.4), (20.4, 22.367), (22.367, 24.633), (24.633, 27.567), (27.567, 28.8)]","[('00:00:00.000', '00:00:03.467'), ('00:00:03.467', '00:00:07.667'), ('00:00:07.667', '00:00:09.800'), ('00:00:09.800', '00:00:11.100'), ('00:00:11.100', '00:00:12.000'), ('00:00:12.000', '00:00:15.067'), ('00:00:15.067', '00:00:17.633'), ('00:00:17.633', '00:00:20.400'), ('00:00:20.400', '00:00:22.367'), ('00:00:22.367', '00:00:24.633'), ('00:00:24.633', '00:00:27.567'), ('00:00:27.567', '00:00:28.800')]",0,12
results/pampersus/C8H-R1VpiBF_2024-06-12_17-48-35_UTC_1," Traveling with babies, wipes edition. Every mom knows that traveling with multiple kids is chaotic and keeping them clean is nearly impossible. That's why I'm so excited to be partnering with Pampers to show you their new free and gentle wipes. Must have for messy diaper changes or on the go. Tip number one, bring wipes with you that you know will get the job done. Nothing's worse than having wipes you can't rely on when you're not at home. These new free and gentle wipes clean better than Huggies Natural Care. Look at how easily it cleans up this peanut butter. Second, when traveling with kids, mess is inevitable. It's so important to have a wipe that's durable, can take on big and small messes. These are five times stronger than Huggies Natural Care to help prevent tearing. Third, having extra wipes on hand while traveling can help with any extra diaper changes or messes. These wipes can tackle just about any mess that comes my way. Happy traveling.",False,True,True,False,False,True,True,False,False,True,False,False,False,False,False,False,False,False,False,False,False,False,False,False,False,False,False,False,False,False,False,False,False,False,False,False,False,False,False,False,False,False,False,False,False,False,False,False,False,False,False,44.3,1.7,False,False,False,False,False,False,False,False,False,False,False,False,False,2,21.06,0,0,0.0,0,"(0, 0)",1,0,"[(0.0, 2.1), (2.1, 2.6), (2.6, 3.167), (3.167, 4.067), (4.067, 4.9), (4.9, 7.333), (7.333, 13.867), (13.867, 16.867), (16.867, 18.333), (18.333, 19.267), (19.267, 20.367), (20.367, 21.5), (21.5, 22.267), (22.267, 23.233), (23.233, 24.6), (24.6, 27.367), (27.367, 31.6), (31.6, 35.5), (35.5, 40.7), (40.7, 41.233), (41.233, 41.967), (41.967, 42.667), (42.667, 43.333), (43.333, 44.167)]","[('00:00:00.000', '00:00:02.100'), ('00:00:02.100', '00:00:02.600'), ('00:00:02.600', '00:00:03.167'), ('00:00:03.167', '00:00:04.067'), ('00:00:04.067', '00:00:04.900'), ('00:00:04.900', '00:00:07.333'), ('00:00:07.333', '00:00:13.867'), ('00:00:13.867', '00:00:16.867'), ('00:00:16.867', '00:00:18.333'), ('00:00:18.333', '00:00:19.267'), ('00:00:19.267', '00:00:20.367'), ('00:00:20.367', '00:00:21.500'), ('00:00:21.500', '00:00:22.267'), ('00:00:22.267', '00:00:23.233'), ('00:00:23.233', '00:00:24.600'), ('00:00:24.600', '00:00:27.367'), ('00:00:27.367', '00:00:31.600'), ('00:00:31.600', '00:00:35.500'), ('00:00:35.500', '00:00:40.700'), ('00:00:40.700', '00:00:41.233'), ('00:00:41.233', '00:00:41.967'), ('00:00:41.967', '00:00:42.667'), ('00:00:42.667', '00:00:43.333'), ('00:00:43.333', '00:00:44.167')]",0,24
results/pampersus/C8H38rlgVtM_2024-06-12_16-58-38_UTC," dance party, dance party, woo woo! Thanks to Pampers for working with me on this video. Because of Pampers Easy Ups partnership with Bluey, there's gonna be tons of reasons for dance parties in my household while I potty train my toddler. Let me give you some of my favorite potty training tips. Make the process fun by adding your toddler's most loved characters in the mix. The Bluey Easy Ups are a fan favorite. My son is beyond excited for this. And my favorite tip of all, have those dance parties anytime your little one is successful on the potty. The Pampers Easy Ups are designed to act and feel like real underwear. This is gonna be the ultimate tool in our toolbox for this journey. Don't miss out on this exciting partnership. Go click on the link in my bio to learn more about this.",False,True,False,False,False,True,True,True,True,False,False,False,False,False,False,False,False,True,False,False,False,False,False,False,False,False,False,False,False,False,False,False,False,False,False,False,False,False,False,False,False,False,False,False,False,False,False,False,False,False,False,42.37,2.66,False,False,False,False,False,False,False,False,False,False,False,False,False,0,0.0,0,0,0.0,0,"(0, 0)",1,0,"[(0.0, 2.733), (2.733, 17.033), (17.033, 19.033), (19.033, 21.5), (21.5, 22.2), (22.2, 23.033), (23.033, 24.467), (24.467, 28.667), (28.667, 42.267)]","[('00:00:00.000', '00:00:02.733'), ('00:00:02.733', '00:00:17.033'), ('00:00:17.033', '00:00:19.033'), ('00:00:19.033', '00:00:21.500'), ('00:00:21.500', '00:00:22.200'), ('00:00:22.200', '00:00:23.033'), ('00:00:23.033', '00:00:24.467'), ('00:00:24.467', '00:00:28.667'), ('00:00:28.667', '00:00:42.267')]",0,9
results/pampersus/C8KaQQKP4ZX_2024-06-13_16-32-27_UTC_1," We all know how stressful potty training can be, especially when you're a mom who's always on the go. So I'm excited to partner up with Pampers Easy Ups to share with you some of my must-haves for potty training while out and about. Besides a comfortable outfit for my daughter, I also need to make sure I have the proper training pants. That's why I'm so excited to be partnering up with Pampers and their partnership with Louie. Pampers Easy Ups help me not stress while we're out of the house because I know they have up to 100% leak-proof protection to absorb any accidents. They also take the pressure off potty training by making it fun with their new Louie print. My daughter's obsessed with Louie, so she's always super excited to wear them. So as a mama who's always on the go and also potty training, I always make sure I have these things. A comfy outfit for my toddler, disposable seat covers, and Pampers Easy Ups featuring Louie. So make sure to check the link in my bio for more details about Pampers Easy Ups.",False,True,False,False,False,True,True,False,False,False,False,False,False,False,False,False,True,True,False,False,False,False,False,False,False,False,False,False,False,False,False,False,False,False,False,False,False,False,False,False,False,False,False,False,False,False,False,False,False,False,False,48.13,5.2,False,False,False,False,False,False,False,False,False,False,False,False,False,0,0.0,0,0,0.0,0,"(0, 0)",1,0,"[(0.0, 11.3), (11.3, 13.5), (13.5, 15.5), (15.5, 19.933), (19.933, 20.967), (20.967, 21.767), (21.767, 22.767), (22.767, 26.2), (26.2, 27.2), (27.2, 28.9), (28.9, 32.3), (32.3, 35.267), (35.267, 36.033), (36.033, 38.5), (38.5, 41.633), (41.633, 44.033), (44.033, 48.033)]","[('00:00:00.000', '00:00:11.300'), ('00:00:11.300', '00:00:13.500'), ('00:00:13.500', '00:00:15.500'), ('00:00:15.500', '00:00:19.933'), ('00:00:19.933', '00:00:20.967'), ('00:00:20.967', '00:00:21.767'), ('00:00:21.767', '00:00:22.767'), ('00:00:22.767', '00:00:26.200'), ('00:00:26.200', '00:00:27.200'), ('00:00:27.200', '00:00:28.900'), ('00:00:28.900', '00:00:32.300'), ('00:00:32.300', '00:00:35.267'), ('00:00:35.267', '00:00:36.033'), ('00:00:36.033', '00:00:38.500'), ('00:00:38.500', '00:00:41.633'), ('00:00:41.633', '00:00:44.033'), ('00:00:44.033', '00:00:48.033')]",0,17
results/pampersus/C8KbMrhuTZ6_2024-06-13_16-41-17_UTC," Today, Kami and I are gonna test out how Shawn knew Pampers Free and Gentle Wipes are. I just got them from Walmart. Are you ready? Yes. I'm just gonna test it out. Did you know Pampers new Free and Gentle Wipes, now available at Walmart, clean better than Huggies Natural Care, can really grip the mess, and are 100% plant-based. Now that I have two kids, I pretty much have double the mess. I am so excited to partner with Pampers and share with you how wonderful these wipes are. They are not only five times stronger than Huggies Natural Care to help prevent tearing, but they also contain 0% alcohol dyes or fragrances. Now you don't have to choose between a wipe that is strong or gentle. So be sure to check out the Pampers Free and Gentle Wipes, now available at Walmart and Walmart.com. Let me know if you try it, bye.",False,True,True,False,False,True,True,False,False,True,False,False,False,False,False,False,True,False,False,False,False,False,False,False,False,False,False,False,False,False,False,False,False,False,False,False,False,False,False,False,False,False,False,False,False,False,False,False,False,False,False,44.58,1.72,False,False,False,False,False,False,False,False,False,False,False,False,False,2,13.9,0,1,31.46,0,"(12.86, 44.32)",1,0,"[(0.0, 2.6), (2.6, 4.2), (4.2, 5.8), (5.8, 6.333), (6.333, 7.033), (7.033, 7.633), (7.633, 8.733), (8.733, 10.433), (10.433, 12.4), (12.4, 13.433), (13.433, 14.0), (14.0, 14.767), (14.767, 15.567), (15.567, 16.0), (16.0, 16.8), (16.8, 17.233), (17.233, 19.333), (19.333, 19.933), (19.933, 20.433), (20.433, 23.433), (23.433, 24.633), (24.633, 25.433), (25.433, 26.6), (26.6, 27.833), (27.833, 28.6), (28.6, 30.067), (30.067, 31.133), (31.133, 32.067), (32.067, 33.2), (33.2, 36.0), (36.0, 37.0), (37.0, 38.433), (38.433, 39.433), (39.433, 41.533), (41.533, 42.0), (42.0, 42.533), (42.533, 43.133), (43.133, 44.467)]","[('00:00:00.000', '00:00:02.600'), ('00:00:02.600', '00:00:04.200'), ('00:00:04.200', '00:00:05.800'), ('00:00:05.800', '00:00:06.333'), ('00:00:06.333', '00:00:07.033'), ('00:00:07.033', '00:00:07.633'), ('00:00:07.633', '00:00:08.733'), ('00:00:08.733', '00:00:10.433'), ('00:00:10.433', '00:00:12.400'), ('00:00:12.400', '00:00:13.433'), ('00:00:13.433', '00:00:14.000'), ('00:00:14.000', '00:00:14.767'), ('00:00:14.767', '00:00:15.567'), ('00:00:15.567', '00:00:16.000'), ('00:00:16.000', '00:00:16.800'), ('00:00:16.800', '00:00:17.233'), ('00:00:17.233', '00:00:19.333'), ('00:00:19.333', '00:00:19.933'), ('00:00:19.933', '00:00:20.433'), ('00:00:20.433', '00:00:23.433'), ('00:00:23.433', '00:00:24.633'), ('00:00:24.633', '00:00:25.433'), ('00:00:25.433', '00:00:26.600'), ('00:00:26.600', '00:00:27.833'), ('00:00:27.833', '00:00:28.600'), ('00:00:28.600', '00:00:30.067'), ('00:00:30.067', '00:00:31.133'), ('00:00:31.133', '00:00:32.067'), ('00:00:32.067', '00:00:33.200'), ('00:00:33.200', '00:00:36.000'), ('00:00:36.000', '00:00:37.000'), ('00:00:37.000', '00:00:38.433'), ('00:00:38.433', '00:00:39.433'), ('00:00:39.433', '00:00:41.533'), ('00:00:41.533', '00:00:42.000'), ('00:00:42.000', '00:00:42.533'), ('00:00:42.533', '00:00:43.133'), ('00:00:43.133', '00:00:44.467')]",1,38
