results/huggies/C3YFmUcMvW4_2024-02-15_17-24-24_UTC_1," Did you know that one in two families experience diaper need? Well, you could help give 2 million diapers to families in need just by shopping Huggies at Sam's Club. For every pack of Huggies diapers or wipes purchased at Sam's Club during February 2024, Huggies is donating one day's worth of diapers to the National Diaper Bank Network. As a family who uses a ton of diapers, I know the impact just one donation can make. Whether you have kids at home in diapers or know an expecting parent, pay it forward and make Huggies at Sam's Club your choice for diapers and wipes.",False,True,True,False,False,True,True,False,False,False,False,False,False,False,False,False,False,False,False,False,False,False,False,False,False,False,False,False,False,False,False,False,False,False,False,False,False,False,False,False,False,False,False,False,False,False,False,False,False,False,False,34.94,3.2600000000000002,False,False,False,False,False,False,False,False,False,False,False,True,False,4,6.24,1,1,0.0,0,"(0, 0)",1,0,"[(0.0, 7.0), (7.0, 8.033), (8.033, 9.267), (9.267, 9.9), (9.9, 10.633), (10.633, 16.467), (16.467, 17.4), (17.4, 20.133), (20.133, 21.4), (21.4, 22.967), (22.967, 23.667), (23.667, 24.467), (24.467, 34.833)]","[('00:00:00.000', '00:00:07.000'), ('00:00:07.000', '00:00:08.033'), ('00:00:08.033', '00:00:09.267'), ('00:00:09.267', '00:00:09.900'), ('00:00:09.900', '00:00:10.633'), ('00:00:10.633', '00:00:16.467'), ('00:00:16.467', '00:00:17.400'), ('00:00:17.400', '00:00:20.133'), ('00:00:20.133', '00:00:21.400'), ('00:00:21.400', '00:00:22.967'), ('00:00:22.967', '00:00:23.667'), ('00:00:23.667', '00:00:24.467'), ('00:00:24.467', '00:00:34.833')]",0,13
results/huggies/C3imYV3vKKS_2024-02-19_19-23-52_UTC_1," Everybody's talking about girl math, but I want to talk about parent math. When going from zero to one kid feels like 100 kids. But if you have three or one kid, one kid feels like no kids. Parent math is when you tell your husband that you need to get groceries and diapers, but instead you use Walmart Plus to get same day free delivery. Technically, I just gave three hours of me time. If one parent changes one overnight diaper, that's equivalent to the other parent changing 10 daytime diapers.",False,True,False,False,False,True,True,False,True,False,False,False,False,False,False,False,False,False,False,False,False,False,False,False,False,False,False,False,False,False,False,False,False,False,False,False,False,False,False,False,False,False,False,False,False,False,False,False,False,False,False,29.72,2.8000000000000003,False,False,False,False,False,False,False,False,False,False,False,False,False,0,0.0,0,0,0.0,0,"(0, 0)",1,0,"[(0.0, 3.167), (3.167, 6.333), (6.333, 10.1), (10.1, 18.433), (18.433, 20.467), (20.467, 22.9), (22.9, 29.567)]","[('00:00:00.000', '00:00:03.167'), ('00:00:03.167', '00:00:06.333'), ('00:00:06.333', '00:00:10.100'), ('00:00:10.100', '00:00:18.433'), ('00:00:18.433', '00:00:20.467'), ('00:00:20.467', '00:00:22.900'), ('00:00:22.900', '00:00:29.567')]",0,7
results/huggies/C3pzW3TsmvN_2024-02-22_14-31-35_UTC_1," The days are long, the years are short, and motherhood is never a straight path. You want to offer your kids healthy food, yet always have treats on hand. You want to protect them, but know you can't win all the battles. You want to nourish them with the best, and maybe a little bit for yourself too. That's why you shop Jewelosco. Everything you need, for everyone in your world. 9.",False,False,False,False,False,False,False,False,False,False,False,False,False,False,False,False,False,False,False,False,False,False,False,False,False,False,False,False,False,False,False,False,False,False,False,False,False,False,False,False,False,False,True,False,False,False,False,False,False,False,False,30.11,7.0,False,False,False,False,False,False,False,False,False,False,False,False,False,0,0.0,0,0,0.0,0,"(0, 0)",1,0,"[(0.0, 2.211), (2.211, 3.587), (3.587, 4.838), (4.838, 6.006), (6.006, 6.882), (6.882, 7.674), (7.674, 8.8), (8.8, 9.968), (9.968, 11.053), (11.053, 11.803), (11.803, 12.638), (12.638, 13.514), (13.514, 14.89), (14.89, 16.016), (16.016, 17.1), (17.1, 18.894), (18.894, 20.812), (20.812, 23.315), (23.315, 24.566), (24.566, 25.776), (25.776, 27.152), (27.152, 30.03)]","[('00:00:00.000', '00:00:02.211'), ('00:00:02.211', '00:00:03.587'), ('00:00:03.587', '00:00:04.838'), ('00:00:04.838', '00:00:06.006'), ('00:00:06.006', '00:00:06.882'), ('00:00:06.882', '00:00:07.674'), ('00:00:07.674', '00:00:08.800'), ('00:00:08.800', '00:00:09.968'), ('00:00:09.968', '00:00:11.053'), ('00:00:11.053', '00:00:11.803'), ('00:00:11.803', '00:00:12.638'), ('00:00:12.638', '00:00:13.514'), ('00:00:13.514', '00:00:14.890'), ('00:00:14.890', '00:00:16.016'), ('00:00:16.016', '00:00:17.100'), ('00:00:17.100', '00:00:18.894'), ('00:00:18.894', '00:00:20.812'), ('00:00:20.812', '00:00:23.315'), ('00:00:23.315', '00:00:24.566'), ('00:00:24.566', '00:00:25.776'), ('00:00:25.776', '00:00:27.152'), ('00:00:27.152', '00:00:30.030')]",0,22
results/huggies/C3vZXrdPYlX_2024-02-24_18-43-38_UTC_1," February is one of my favorite months. Yes, it's Nia's birthday month, but it's also Black History Month. In honor of Black History Month, Nia and I are taking a trip to Walmart to pick up Huggies Nourish Wipes. Nia was napping and Mama was exhausted today, so thank goodness for Walmart curbside pickup. My order was ready within two hours of placing and they brought it right out to my car. And if you're wondering, yes, it's 100% free. I love that these wipes are enriched with cocoa and shea butter, making them suitable for melanin-rich skin while providing a calming scent. I sometimes even find myself using them at times. These are 100% my new go-to wipes for Nia. You're good. I love that this multitude of washes away from the uplifting world. That's when I take responsibility for the pelotas and the correctness of the perspynes for theода of representationLevel. I think that it sets all the same. And I try to encrypt the cuts and it hits free. I have I found those on between records already and it's not going to необходimably. Don't be xem that the letters is submitted for anything that you use for. The piano do not care whether calorie or diet changes the amount of per se have any information or unit of weight either. If this was done before, I would like to rereath a story called USilles Dinoточs for the reason when White Huggies Nourish Wipes. Ok, should I admit it?",False,True,True,False,False,True,True,True,True,True,False,True,True,True,False,False,False,False,False,False,False,False,False,False,False,False,False,False,False,False,False,False,False,False,False,False,False,False,False,False,False,False,True,False,False,False,False,False,False,False,False,30.38,1.36,False,False,False,False,False,False,False,False,False,False,False,False,False,2,6.18,1,1,0.0,0,"(0, 0)",1,0,"[(0.0, 0.9), (0.9, 1.5), (1.5, 3.0), (3.0, 3.633), (3.633, 4.4), (4.4, 5.1), (5.1, 5.8), (5.8, 7.0), (7.0, 7.533), (7.533, 8.033), (8.033, 8.6), (8.6, 9.133), (9.133, 9.7), (9.7, 10.333), (10.333, 11.333), (11.333, 12.2), (12.2, 12.8), (12.8, 13.3), (13.3, 13.833), (13.833, 14.533), (14.533, 15.1), (15.1, 15.633), (15.633, 16.2), (16.2, 16.733), (16.733, 17.3), (17.3, 17.9), (17.9, 18.433), (18.433, 19.267), (19.267, 20.2), (20.2, 20.867), (20.867, 21.367), (21.367, 21.933), (21.933, 22.9), (22.9, 24.8), (24.8, 25.233), (25.233, 26.0), (26.0, 26.5), (26.5, 27.5), (27.5, 28.033), (28.033, 28.9), (28.9, 29.433), (29.433, 30.267)]","[('00:00:00.000', '00:00:00.900'), ('00:00:00.900', '00:00:01.500'), ('00:00:01.500', '00:00:03.000'), ('00:00:03.000', '00:00:03.633'), ('00:00:03.633', '00:00:04.400'), ('00:00:04.400', '00:00:05.100'), ('00:00:05.100', '00:00:05.800'), ('00:00:05.800', '00:00:07.000'), ('00:00:07.000', '00:00:07.533'), ('00:00:07.533', '00:00:08.033'), ('00:00:08.033', '00:00:08.600'), ('00:00:08.600', '00:00:09.133'), ('00:00:09.133', '00:00:09.700'), ('00:00:09.700', '00:00:10.333'), ('00:00:10.333', '00:00:11.333'), ('00:00:11.333', '00:00:12.200'), ('00:00:12.200', '00:00:12.800'), ('00:00:12.800', '00:00:13.300'), ('00:00:13.300', '00:00:13.833'), ('00:00:13.833', '00:00:14.533'), ('00:00:14.533', '00:00:15.100'), ('00:00:15.100', '00:00:15.633'), ('00:00:15.633', '00:00:16.200'), ('00:00:16.200', '00:00:16.733'), ('00:00:16.733', '00:00:17.300'), ('00:00:17.300', '00:00:17.900'), ('00:00:17.900', '00:00:18.433'), ('00:00:18.433', '00:00:19.267'), ('00:00:19.267', '00:00:20.200'), ('00:00:20.200', '00:00:20.867'), ('00:00:20.867', '00:00:21.367'), ('00:00:21.367', '00:00:21.933'), ('00:00:21.933', '00:00:22.900'), ('00:00:22.900', '00:00:24.800'), ('00:00:24.800', '00:00:25.233'), ('00:00:25.233', '00:00:26.000'), ('00:00:26.000', '00:00:26.500'), ('00:00:26.500', '00:00:27.500'), ('00:00:27.500', '00:00:28.033'), ('00:00:28.033', '00:00:28.900'), ('00:00:28.900', '00:00:29.433'), ('00:00:29.433', '00:00:30.267')]",0,42
results/huggies/C4Q2MLaPuyO_2024-03-08_18-25-31_UTC_1," You guys know by now that our bedtime routine is our favorite part of the day. And I feel like I've mastered a successful routine with three easy steps. And with daylight savings approaching, routines are even more important. I realized Nia was out of a few bedtime essentials a few hours ago, so I placed a quick order using Walmart Plus. And perfect timing because they were delivered right to my doorstep after dinner. Now, I don't know about you, but Huggies Overnight Diapers are my go-to now at bedtime for an up to 100% leak-free night for Nia. Okay, step one is a fun bath. I let Nia splash around until she's ready to get out by telling me, Out, mama! Which usually takes her about 20 minutes. Step two is a relaxing massage with Johnson's Moisturizing Bedtime Baby Lotion. This is my current fave lotion for Nia because it moisturizes while the natural coconut oil nourishes and the natural calm aromas help soothe Nia all at once. When she's all dressed for bed, we read a bedtime story, which makes me to the final step, quiet time. And voila, within 10 minutes, she's asleep. And it's time for some much-needed me time, which I can enjoy peacefully knowing Nia will stay asleep with diapers that provide her with up to 12 hours of long-lasting protection.",False,True,True,False,False,True,True,True,True,False,False,False,False,True,False,True,False,False,False,False,False,False,False,False,False,False,False,False,False,False,False,False,False,False,False,False,False,False,False,False,False,False,False,False,False,False,False,False,False,False,False,54.23,2.88,False,False,False,False,False,False,False,False,False,False,False,False,False,1,18.17,0,1,0.0,0,"(0, 0)",1,0,"[(0.0, 1.207), (1.207, 2.552), (2.552, 4.241), (4.241, 5.207), (5.207, 6.897), (6.897, 7.828), (7.828, 8.69), (8.69, 9.552), (9.552, 10.483), (10.483, 11.034), (11.034, 11.586), (11.586, 12.138), (12.138, 12.724), (12.724, 14.069), (14.069, 14.793), (14.793, 15.448), (15.448, 16.0), (16.0, 16.793), (16.793, 17.448), (17.448, 18.103), (18.103, 18.931), (18.931, 20.034), (20.034, 20.862), (20.862, 21.724), (21.724, 22.724), (22.724, 23.552), (23.552, 25.103), (25.103, 25.862), (25.862, 26.724), (26.724, 28.276), (28.276, 28.862), (28.862, 29.552), (29.552, 30.759), (30.759, 31.586), (31.586, 32.138), (32.138, 32.862), (32.862, 33.517), (33.517, 35.103), (35.103, 35.897), (35.897, 37.517), (37.517, 39.276), (39.276, 39.759), (39.759, 40.483), (40.483, 41.069), (41.069, 41.69), (41.69, 42.552), (42.552, 43.241), (43.241, 43.931), (43.931, 44.621), (44.621, 47.414), (47.414, 48.414), (48.414, 50.138), (50.138, 50.586), (50.586, 52.069), (52.069, 52.966), (52.966, 54.103)]","[('00:00:00.000', '00:00:01.207'), ('00:00:01.207', '00:00:02.552'), ('00:00:02.552', '00:00:04.241'), ('00:00:04.241', '00:00:05.207'), ('00:00:05.207', '00:00:06.897'), ('00:00:06.897', '00:00:07.828'), ('00:00:07.828', '00:00:08.690'), ('00:00:08.690', '00:00:09.552'), ('00:00:09.552', '00:00:10.483'), ('00:00:10.483', '00:00:11.034'), ('00:00:11.034', '00:00:11.586'), ('00:00:11.586', '00:00:12.138'), ('00:00:12.138', '00:00:12.724'), ('00:00:12.724', '00:00:14.069'), ('00:00:14.069', '00:00:14.793'), ('00:00:14.793', '00:00:15.448'), ('00:00:15.448', '00:00:16.000'), ('00:00:16.000', '00:00:16.793'), ('00:00:16.793', '00:00:17.448'), ('00:00:17.448', '00:00:18.103'), ('00:00:18.103', '00:00:18.931'), ('00:00:18.931', '00:00:20.034'), ('00:00:20.034', '00:00:20.862'), ('00:00:20.862', '00:00:21.724'), ('00:00:21.724', '00:00:22.724'), ('00:00:22.724', '00:00:23.552'), ('00:00:23.552', '00:00:25.103'), ('00:00:25.103', '00:00:25.862'), ('00:00:25.862', '00:00:26.724'), ('00:00:26.724', '00:00:28.276'), ('00:00:28.276', '00:00:28.862'), ('00:00:28.862', '00:00:29.552'), ('00:00:29.552', '00:00:30.759'), ('00:00:30.759', '00:00:31.586'), ('00:00:31.586', '00:00:32.138'), ('00:00:32.138', '00:00:32.862'), ('00:00:32.862', '00:00:33.517'), ('00:00:33.517', '00:00:35.103'), ('00:00:35.103', '00:00:35.897'), ('00:00:35.897', '00:00:37.517'), ('00:00:37.517', '00:00:39.276'), ('00:00:39.276', '00:00:39.759'), ('00:00:39.759', '00:00:40.483'), ('00:00:40.483', '00:00:41.069'), ('00:00:41.069', '00:00:41.690'), ('00:00:41.690', '00:00:42.552'), ('00:00:42.552', '00:00:43.241'), ('00:00:43.241', '00:00:43.931'), ('00:00:43.931', '00:00:44.621'), ('00:00:44.621', '00:00:47.414'), ('00:00:47.414', '00:00:48.414'), ('00:00:48.414', '00:00:50.138'), ('00:00:50.138', '00:00:50.586'), ('00:00:50.586', '00:00:52.069'), ('00:00:52.069', '00:00:52.966'), ('00:00:52.966', '00:00:54.103')]",0,56
results/huggies/C4vRfrLsxhA_2024-03-20_14-01-19_UTC," The days are long, the years are short, and motherhood is never a straight path. You want to offer your kids healthy food, yet always have treats on hand. You want to protect them, but know you can't win all the battles. You want to nourish them with the best, and maybe a little bit for yourself too. That's why you shop Jewelosco. Everything you need, for everyone in your world. I love you, I don't care about you. I like around the corner of alone... Who are women who like me... Well, I'm torn by people. I wish I my mother lived here... We don't thought about doing what a Yios ride into媽... ...well, tell me what... It different between us, and I have to makeverick, if we look up Toledo, the world haveta is입. And I love you. It's not my saiy fruits. But there's a ramp to keep me here. You still care about me finding how we rank out. It's a beautiful crispness, hopefully, but what we know of myself.",False,True,False,False,False,True,True,False,True,False,False,False,False,False,False,False,False,False,False,False,False,False,False,False,False,False,False,False,False,False,False,False,False,False,False,False,False,False,False,False,False,False,True,False,False,False,False,False,False,False,False,30.11,7.0,False,False,False,False,False,False,False,False,False,False,False,False,False,0,0.0,0,0,0.0,0,"(0, 0)",1,0,"[(0.0, 2.211), (2.211, 3.587), (3.587, 4.838), (4.838, 6.006), (6.006, 6.882), (6.882, 7.674), (7.674, 8.8), (8.8, 9.968), (9.968, 11.053), (11.053, 11.803), (11.803, 12.638), (12.638, 13.513), (13.513, 14.89), (14.89, 16.016), (16.016, 17.1), (17.1, 18.894), (18.894, 20.812), (20.812, 23.315), (23.315, 24.566), (24.566, 25.776), (25.776, 27.152), (27.152, 30.03)]","[('00:00:00.000', '00:00:02.211'), ('00:00:02.211', '00:00:03.587'), ('00:00:03.587', '00:00:04.838'), ('00:00:04.838', '00:00:06.006'), ('00:00:06.006', '00:00:06.882'), ('00:00:06.882', '00:00:07.674'), ('00:00:07.674', '00:00:08.800'), ('00:00:08.800', '00:00:09.968'), ('00:00:09.968', '00:00:11.053'), ('00:00:11.053', '00:00:11.803'), ('00:00:11.803', '00:00:12.638'), ('00:00:12.638', '00:00:13.513'), ('00:00:13.513', '00:00:14.890'), ('00:00:14.890', '00:00:16.016'), ('00:00:16.016', '00:00:17.100'), ('00:00:17.100', '00:00:18.894'), ('00:00:18.894', '00:00:20.812'), ('00:00:20.812', '00:00:23.315'), ('00:00:23.315', '00:00:24.566'), ('00:00:24.566', '00:00:25.776'), ('00:00:25.776', '00:00:27.152'), ('00:00:27.152', '00:00:30.030')]",0,22
results/huggies/C53oPisRA7v_2024-04-17_16-25-33_UTC_1," I pack my hospital bag with me as a fifth time mom. This is my fifth baby in four years, so I'm a pro at just packing the essentials. My first go around, I packed anything and everything, but with each pregnancy, my bag has gotten smaller and smaller. I pack two going home outfits, one small and one a little larger because I don't really know what size the baby will be. A noise machine, baby blanket for the ride home, burp cloth, swaddle blanket so we don't have to use the scratchy hospital ones, and pacifier. I also pack my own Huggies little snugglers and natural care wipes. The diapers have a contoured shape that I love and they feel so soft for my new little baby. And the natural care wipes are great for sensitive skin for newborns. I also have my diaper set to be delivered at my house through Walmart Plus because we won't be leaving the house for a while once the baby comes. Now, all I need to do is pack my hospital bag and we're all set.",False,True,False,False,False,True,True,True,True,False,False,False,False,False,True,False,False,False,False,False,False,False,False,False,False,False,False,False,False,False,False,False,False,False,False,False,False,False,False,False,False,False,False,False,False,False,False,False,False,False,False,40.89,2.0,False,False,False,False,False,False,False,False,False,False,False,False,False,1,23.77,0,0,0.0,0,"(0, 0)",1,0,"[(0.0, 2.167), (2.167, 11.433), (11.433, 15.2), (15.2, 18.033), (18.033, 21.633), (21.633, 23.767), (23.767, 26.4), (26.4, 30.4), (30.4, 33.133), (33.133, 38.967), (38.967, 40.8)]","[('00:00:00.000', '00:00:02.167'), ('00:00:02.167', '00:00:11.433'), ('00:00:11.433', '00:00:15.200'), ('00:00:15.200', '00:00:18.033'), ('00:00:18.033', '00:00:21.633'), ('00:00:21.633', '00:00:23.767'), ('00:00:23.767', '00:00:26.400'), ('00:00:26.400', '00:00:30.400'), ('00:00:30.400', '00:00:33.133'), ('00:00:33.133', '00:00:38.967'), ('00:00:38.967', '00:00:40.800')]",0,11
results/huggies/C5EN-hWLUmw_2024-03-28_17-19-34_UTC," Let's make a special moment with Jewel Osco. Shopping at Jewel makes weeknight meal prep quick and easy. Tonight I'm making a nourishing and balanced salad and grain bowl. It's made with sweet onion dressing, mixed greens, baked sweet potatoes, red onions, blueberries, feta, brown rice and quinoa, and glazed cashews. It's a simple and delicious meal that my whole family loves. Plus it makes great leftovers for lunch the next day. And of course I need to grab some flowers to help brighten up my kitchen. Now through April 9th, Jewel Osco is partnering with Huggies to celebrate moms and their special moments. You can nominate a deserving mom for a chance to win one of 50 surprise grocery deliveries valued at over $500. Nominees will also be eligible to win one of 50 tickets to the Jewel Osco Momentus Celebration at the Four Seasons Chicago on May 9th. Also presented by Kimberly Clark and Kraft. Make your nomination via the link in my bio today. Thank you to Jewel Osco for helping us create these special moments. Thank you.",False,False,False,False,False,False,True,False,False,False,False,False,False,False,False,False,False,False,False,False,False,False,False,False,False,False,False,False,False,False,False,False,False,False,False,False,False,False,False,False,False,False,False,False,False,False,False,False,False,False,False,73.09,2.2800000000000002,False,False,False,False,False,False,False,False,False,False,False,False,False,1,39.77,0,0,0.0,0,"(0, 0)",1,0,"[(0.0, 2.667), (2.667, 3.767), (3.767, 4.8), (4.8, 7.433), (7.433, 8.5), (8.5, 10.167), (10.167, 12.167), (12.167, 13.1), (13.1, 14.4), (14.4, 16.733), (16.733, 18.1), (18.1, 19.267), (19.267, 20.933), (20.933, 22.667), (22.667, 24.333), (24.333, 27.567), (27.567, 30.6), (30.6, 33.067), (33.067, 34.2), (34.2, 36.1), (36.1, 39.033), (39.033, 40.533), (40.533, 46.3), (46.3, 49.2), (49.2, 64.633), (64.633, 66.733), (66.733, 69.633), (69.633, 71.8), (71.8, 72.967)]","[('00:00:00.000', '00:00:02.667'), ('00:00:02.667', '00:00:03.767'), ('00:00:03.767', '00:00:04.800'), ('00:00:04.800', '00:00:07.433'), ('00:00:07.433', '00:00:08.500'), ('00:00:08.500', '00:00:10.167'), ('00:00:10.167', '00:00:12.167'), ('00:00:12.167', '00:00:13.100'), ('00:00:13.100', '00:00:14.400'), ('00:00:14.400', '00:00:16.733'), ('00:00:16.733', '00:00:18.100'), ('00:00:18.100', '00:00:19.267'), ('00:00:19.267', '00:00:20.933'), ('00:00:20.933', '00:00:22.667'), ('00:00:22.667', '00:00:24.333'), ('00:00:24.333', '00:00:27.567'), ('00:00:27.567', '00:00:30.600'), ('00:00:30.600', '00:00:33.067'), ('00:00:33.067', '00:00:34.200'), ('00:00:34.200', '00:00:36.100'), ('00:00:36.100', '00:00:39.033'), ('00:00:39.033', '00:00:40.533'), ('00:00:40.533', '00:00:46.300'), ('00:00:46.300', '00:00:49.200'), ('00:00:49.200', '00:01:04.633'), ('00:01:04.633', '00:01:06.733'), ('00:01:06.733', '00:01:09.633'), ('00:01:09.633', '00:01:11.800'), ('00:01:11.800', '00:01:12.967')]",0,29
results/huggies/C5OSeeOscCt_2024-04-01_15-06-55_UTC_1, Thank you.,False,False,False,False,False,False,False,False,False,False,False,False,False,False,False,False,False,False,False,False,False,False,False,False,False,False,False,False,False,False,False,False,False,False,False,False,False,False,False,False,False,False,False,False,False,False,False,False,False,False,False,12.09,29.98,False,False,False,False,False,False,False,False,False,False,False,False,False,0,0.0,0,0,0.0,0,"(0, 0)",0,0,"[(0.0, 1.533), (1.533, 3.633), (3.633, 5.1), (5.1, 6.633), (6.633, 7.833), (7.833, 10.3), (10.3, 11.367), (11.367, 11.967)]","[('00:00:00.000', '00:00:01.533'), ('00:00:01.533', '00:00:03.633'), ('00:00:03.633', '00:00:05.100'), ('00:00:05.100', '00:00:06.633'), ('00:00:06.633', '00:00:07.833'), ('00:00:07.833', '00:00:10.300'), ('00:00:10.300', '00:00:11.367'), ('00:00:11.367', '00:00:11.967')]",0,8
results/huggies/C61N2jtOAy8_2024-05-11_14-28-10_UTC," got one hand holding legs, blow out out the back, trying to manage two other kids. I need my wipes to make my life easier, not harder. There's already enough mess. There's already a lot to manage. I need my wipes to be thick and have good hand protection because I don't want more mess on me. And I need them to be sensitive on my baby skin. If you use Huggy sensitive wipes, they actually dispense one at a time. Truly nothing is more annoying than pulling wipes out and 50 come out at the same time. I need wipes to work the first time. I need to do it with one hand. And they need to be soft on baby skin. Boom, bam, done.",False,False,True,False,False,True,True,False,False,True,False,False,False,False,False,False,False,False,False,False,False,False,False,False,False,False,False,False,False,False,False,False,False,False,False,False,False,False,False,False,False,False,False,False,False,False,False,False,False,False,False,22.66,3.88,False,False,False,False,False,False,False,False,False,False,False,False,False,0,0.0,0,0,0.0,0,"(0, 0)",1,0,"[(0.0, 0.767), (0.767, 1.967), (1.967, 3.5), (3.5, 4.1), (4.1, 5.133), (5.133, 5.7), (5.7, 6.967), (6.967, 7.467), (7.467, 8.5), (8.5, 8.933), (8.933, 11.1), (11.1, 11.9), (11.9, 12.767), (12.767, 15.033), (15.033, 16.3), (16.3, 16.733), (16.733, 17.4), (17.4, 19.067), (19.067, 22.567)]","[('00:00:00.000', '00:00:00.767'), ('00:00:00.767', '00:00:01.967'), ('00:00:01.967', '00:00:03.500'), ('00:00:03.500', '00:00:04.100'), ('00:00:04.100', '00:00:05.133'), ('00:00:05.133', '00:00:05.700'), ('00:00:05.700', '00:00:06.967'), ('00:00:06.967', '00:00:07.467'), ('00:00:07.467', '00:00:08.500'), ('00:00:08.500', '00:00:08.933'), ('00:00:08.933', '00:00:11.100'), ('00:00:11.100', '00:00:11.900'), ('00:00:11.900', '00:00:12.767'), ('00:00:12.767', '00:00:15.033'), ('00:00:15.033', '00:00:16.300'), ('00:00:16.300', '00:00:16.733'), ('00:00:16.733', '00:00:17.400'), ('00:00:17.400', '00:00:19.067'), ('00:00:19.067', '00:00:22.567')]",0,19
