results/mymilliemoon/DBRrUMBySnN_2024-10-18_18-53-26_UTC," Hey guys, let me show you the number one gift to bring to the baby shower. Millie Moon is a luxury diaper and now they are available at a newborn size as well. What I would absolutely love about them is other than the cute print is that they are super soft and it has no toxic ingredient. The other amazing part is that it has the cut so the diaper doesn't need to be folded. Millie Moon is available at Target right now. So if you know a mom who's expecting or you're heading to a baby shower right now, then this is the best gift for them.",False,True,True,False,False,True,True,False,True,True,False,False,False,False,False,False,False,False,False,False,False,False,False,False,False,False,False,False,False,False,False,False,False,False,False,False,False,False,False,False,False,False,False,False,False,False,False,False,False,False,False,34.62,3.68,False,False,False,False,False,False,False,False,False,False,False,False,False,2,6.52,1,1,23.480000000000004,0,"(4.08, 27.560000000000002)",1,0,"[(0.0, 5.433), (5.433, 26.767), (26.767, 34.533)]","[('00:00:00.000', '00:00:05.433'), ('00:00:05.433', '00:00:26.767'), ('00:00:26.767', '00:00:34.533')]",1,3
results/pampersus/C-8ZINFJTN0_2024-08-21_19-27-10_UTC," If you're looking for wipes that contain 0% alcohols, dyes, or fragrances that you can pick up at Stop and Shop, stop what you're doing. I am so excited to be partnering with Pampers again as I have been so impressed with their Free and Gentle wipes that are 100% plant-based. These wipes clean better than the Huggies Natural Care and grip the mess. I'll soon have double the messes to clean and I'm so happy to now have a strong, reliable wipe like the Pampers Free and Gentle. You can pick these up at Stop and Shop today.",False,True,False,False,False,True,True,False,True,True,False,False,False,False,False,False,False,False,False,False,False,False,False,False,False,False,False,False,False,False,False,False,False,False,False,False,False,False,False,False,False,False,False,False,False,False,False,False,False,False,False,23.98,6.0200000000000005,False,False,False,False,False,False,False,False,False,False,False,False,False,1,13.86,0,0,0.0,0,"(0, 0)",1,0,"[(0.0, 3.567), (3.567, 4.833), (4.833, 6.167), (6.167, 7.7), (7.7, 8.933), (8.933, 11.433), (11.433, 16.267), (16.267, 16.833), (16.833, 19.133), (19.133, 21.4), (21.4, 23.9)]","[('00:00:00.000', '00:00:03.567'), ('00:00:03.567', '00:00:04.833'), ('00:00:04.833', '00:00:06.167'), ('00:00:06.167', '00:00:07.700'), ('00:00:07.700', '00:00:08.933'), ('00:00:08.933', '00:00:11.433'), ('00:00:11.433', '00:00:16.267'), ('00:00:16.267', '00:00:16.833'), ('00:00:16.833', '00:00:19.133'), ('00:00:19.133', '00:00:21.400'), ('00:00:21.400', '00:00:23.900')]",0,11
results/pampersus/C-8jjrLSwpH_2024-08-21_21-01-14_UTC, Redbirds singin' in the dead arm,False,False,False,False,False,False,False,False,False,False,False,False,False,False,False,False,False,False,False,False,False,False,False,False,False,False,False,False,False,False,False,False,False,False,False,False,False,False,False,False,False,False,False,False,False,False,False,False,False,False,False,3.78,2.0,False,False,False,False,False,False,False,False,False,False,False,False,False,0,0.0,0,0,0.0,0,"(0, 0)",0,0,"[(0.0, 1.967), (1.967, 3.667)]","[('00:00:00.000', '00:00:01.967'), ('00:00:01.967', '00:00:03.667')]",0,2
results/pampersus/C-EAjnYp9AR_2024-07-30_21-56-25_UTC_1," I am so excited to partner with Pampers to share that for every Pampers Swaddlers huge pack purchased at Walmart, Pampers is donating one preemie diaper to Children's Miracle Network Hospitals now through September 2nd. Pampers is the number one choice of U.S. hospitals and the diaper recommended by 95% of NICU nurses. Pampers Swaddlers provides up to 100% leak-proof protection and is gentle enough for even the most sensitive preemie skin. Stock up while giving back. Look for Pampers Swaddlers huge pack at Walmart and support NICU babies across the U.S. through September 2nd.",False,True,False,False,False,True,True,False,False,False,False,False,False,False,False,False,True,False,False,False,False,False,False,False,False,False,False,False,False,False,False,False,False,False,False,False,False,False,False,False,False,False,False,False,False,False,False,False,False,False,False,38.01,6.6000000000000005,False,False,False,False,False,False,False,False,False,False,False,False,False,0,0.0,0,0,0.0,0,"(0, 0)",1,0,"[(0.0, 2.567), (2.567, 11.6), (11.6, 23.767), (23.767, 34.067), (34.067, 37.967)]","[('00:00:00.000', '00:00:02.567'), ('00:00:02.567', '00:00:11.600'), ('00:00:11.600', '00:00:23.767'), ('00:00:23.767', '00:00:34.067'), ('00:00:34.067', '00:00:37.967')]",0,5
results/pampersus/C-EIa8wS7Hm_2024-07-30_23-03-29_UTC_1," Are you tired of the diaper struggles? I'm ready to start potty training, but kind of nervous to start potty training. If you're a toddler parent, you definitely know the struggles that comes with potty training. Thankfully, we have Pampers Easy Ups in this house, featuring our favorite character, Bluey. We're toddlers gonna be super excited to wear this. We are so excited to partner with Pampers Easy Ups to add these to our potty training routine. These trainee underwear also are super comfortable, have a stretchy fit, perfect for a toddler. What I love most about Pampers Easy Ups is that it helps foster my child's independence because she's able to put these on by herself. When she uses the restroom, she could pull them down and easily get them back up, which helps foster her independence and confidence, so she's willing to go to the bathroom all by herself. Ready to make potty training easier for you and your little one? Go check out the link in my bio to say goodbye to diapers and hello to Pampers Easy Ups featuring Bluey, perfect partner for your child's potty training milestones.",False,True,False,False,False,True,True,False,True,False,False,False,False,False,False,False,True,True,False,False,False,False,False,False,False,False,False,False,False,False,False,False,False,False,False,False,False,False,False,False,False,False,False,False,False,False,False,False,False,False,False,52.82,2.0,False,False,False,False,False,False,False,False,False,False,False,False,False,0,0.0,0,0,0.0,0,"(0, 0)",1,0,"[(0.0, 0.833), (0.833, 2.067), (2.067, 3.667), (3.667, 5.433), (5.433, 6.433), (6.433, 7.967), (7.967, 9.733), (9.733, 10.767), (10.767, 12.567), (12.567, 14.2), (14.2, 14.933), (14.933, 15.7), (15.7, 16.767), (16.767, 17.4), (17.4, 18.467), (18.467, 20.0), (20.0, 21.267), (21.267, 23.333), (23.333, 24.867), (24.867, 25.667), (25.667, 37.9), (37.9, 43.567), (43.567, 45.233), (45.233, 46.7), (46.7, 47.8), (47.8, 48.6), (48.6, 50.3), (50.3, 51.5), (51.5, 52.733)]","[('00:00:00.000', '00:00:00.833'), ('00:00:00.833', '00:00:02.067'), ('00:00:02.067', '00:00:03.667'), ('00:00:03.667', '00:00:05.433'), ('00:00:05.433', '00:00:06.433'), ('00:00:06.433', '00:00:07.967'), ('00:00:07.967', '00:00:09.733'), ('00:00:09.733', '00:00:10.767'), ('00:00:10.767', '00:00:12.567'), ('00:00:12.567', '00:00:14.200'), ('00:00:14.200', '00:00:14.933'), ('00:00:14.933', '00:00:15.700'), ('00:00:15.700', '00:00:16.767'), ('00:00:16.767', '00:00:17.400'), ('00:00:17.400', '00:00:18.467'), ('00:00:18.467', '00:00:20.000'), ('00:00:20.000', '00:00:21.267'), ('00:00:21.267', '00:00:23.333'), ('00:00:23.333', '00:00:24.867'), ('00:00:24.867', '00:00:25.667'), ('00:00:25.667', '00:00:37.900'), ('00:00:37.900', '00:00:43.567'), ('00:00:43.567', '00:00:45.233'), ('00:00:45.233', '00:00:46.700'), ('00:00:46.700', '00:00:47.800'), ('00:00:47.800', '00:00:48.600'), ('00:00:48.600', '00:00:50.300'), ('00:00:50.300', '00:00:51.500'), ('00:00:51.500', '00:00:52.733')]",0,29
results/pampersus/C-EXfNpsxq6_2024-07-31_01-19-59_UTC_1," Diaper changes are stress-free when you have the right wipes. I've partnered with Pampers to bring you my top three parenting hacks for easy diaper changes. Number one is to shop in an affordable store that stocks up on all the best products. Pampers just released their new free and gentle wipes, which are available at a food line near you. Don't forget to stop by the kiosk to check for P&G digital coupons. Number two is to find a gentle wipe that won't tear under pressure. These wipes are five times stronger and clean better than Huggies Natural Care, giving you the confidence for every cleanup. And number three is to give your little one a toy during diaper changes. This is sure to keep them happy without all the tossing and turning. So make a trip to Food Lion today to pick up the new Pampers free and gentle wipes and feel the difference for yourself.",False,True,True,False,False,True,True,True,False,True,False,False,False,False,False,False,False,False,False,False,False,False,False,False,False,False,False,False,False,False,False,False,False,False,False,False,False,False,False,False,False,False,False,False,False,False,False,False,False,False,False,40.24,2.58,False,False,False,False,False,False,False,False,False,False,False,False,False,2,17.11,0,1,0.0,0,"(0, 0)",1,0,"[(0.0, 2.667), (2.667, 4.033), (4.033, 5.3), (5.3, 6.1), (6.1, 7.733), (7.733, 11.367), (11.367, 16.567), (16.567, 20.0), (20.0, 21.5), (21.5, 22.1), (22.1, 22.533), (22.533, 23.633), (23.633, 24.767), (24.767, 28.533), (28.533, 33.633), (33.633, 38.8), (38.8, 40.133)]","[('00:00:00.000', '00:00:02.667'), ('00:00:02.667', '00:00:04.033'), ('00:00:04.033', '00:00:05.300'), ('00:00:05.300', '00:00:06.100'), ('00:00:06.100', '00:00:07.733'), ('00:00:07.733', '00:00:11.367'), ('00:00:11.367', '00:00:16.567'), ('00:00:16.567', '00:00:20.000'), ('00:00:20.000', '00:00:21.500'), ('00:00:21.500', '00:00:22.100'), ('00:00:22.100', '00:00:22.533'), ('00:00:22.533', '00:00:23.633'), ('00:00:23.633', '00:00:24.767'), ('00:00:24.767', '00:00:28.533'), ('00:00:28.533', '00:00:33.633'), ('00:00:33.633', '00:00:38.800'), ('00:00:38.800', '00:00:40.133')]",0,17
results/pampersus/C-L7Ys8S255_2024-08-02_23-44-36_UTC," Finally, the potty training journey is over for us, but the adventure doesn't end there. We're so excited to partner up with Pampers Easy Ups to share our tips and tricks on potty training with our niece and nephew. The Pampers Easy Ups are super comfy and soft. They have a 360 degree waistband. They also have an easy tear side. They are up to 100% leak proof to help with any accidents and the new bluey design is super cute. And I'll see you next time. Bye. Bye. Bye. Bye. Bye. Bye. Bye. Bye. Bye.",False,True,False,False,False,True,True,False,False,False,False,False,False,False,False,False,True,False,False,False,False,False,False,False,False,False,False,False,False,False,False,False,False,False,False,False,False,False,False,False,False,False,False,False,False,False,False,False,False,False,False,31.16,5.4,False,False,False,False,False,False,False,False,False,False,False,False,False,0,0.0,0,0,0.0,0,"(0, 0)",1,0,"[(0.0, 1.143), (1.143, 5.19), (5.19, 6.19), (6.19, 6.952), (6.952, 7.857), (7.857, 9.429), (9.429, 10.238), (10.238, 12.952), (12.952, 17.571), (17.571, 24.238), (24.238, 25.286), (25.286, 25.905), (25.905, 28.286), (28.286, 29.286), (29.286, 30.524), (30.524, 31.048)]","[('00:00:00.000', '00:00:01.143'), ('00:00:01.143', '00:00:05.190'), ('00:00:05.190', '00:00:06.190'), ('00:00:06.190', '00:00:06.952'), ('00:00:06.952', '00:00:07.857'), ('00:00:07.857', '00:00:09.429'), ('00:00:09.429', '00:00:10.238'), ('00:00:10.238', '00:00:12.952'), ('00:00:12.952', '00:00:17.571'), ('00:00:17.571', '00:00:24.238'), ('00:00:24.238', '00:00:25.286'), ('00:00:25.286', '00:00:25.905'), ('00:00:25.905', '00:00:28.286'), ('00:00:28.286', '00:00:29.286'), ('00:00:29.286', '00:00:30.524'), ('00:00:30.524', '00:00:31.048')]",0,16
results/pampersus/C-Lo_7ehvvY_2024-08-02_21-02-22_UTC," Parenting, it's a wild ride, but nothing, and I mean nothing, prepares you for... Potty training. You try everything, the books, the apps, the stickers, but somehow your toddler thinks the rug is a better option. Okay, so if you use the potty, then you get to pick out a sticker and then you can put it on your chart. Doesn't that sound like so much fun? No. Yeah, not so much. What could make this more fun? Oh, Bluey! Don't worry, parents. Bluey and Pampers Easy Ups is here to save the day. Introducing Pampers Easy Ups training underwear. Now with Bluey! With their Easy Up and Easy Down design, fun Bluey patterns, and a little help from everyone's favorite blue healer, your little one will be potty trained in no time. Thanks to Bluey and Pampers Easy Ups for partnering with me on this video. Bluey! Potty training is no longer a nightmare. It's actually kind of fun!",True,True,True,True,True,True,True,False,True,True,False,False,False,False,False,False,False,False,False,False,False,False,False,False,False,False,False,False,False,False,False,False,False,False,False,False,False,False,False,False,False,False,False,False,False,False,False,False,False,False,False,48.94,2.24,False,False,False,False,False,False,False,False,False,False,False,False,False,0,0.0,0,0,0.0,0,"(0, 0)",1,0,"[(0.0, 3.967), (3.967, 4.567), (4.567, 5.833), (5.833, 11.6), (11.6, 20.4), (20.4, 22.233), (22.233, 24.4), (24.4, 25.733), (25.733, 26.867), (26.867, 28.6), (28.6, 30.533), (30.533, 35.833), (35.833, 37.733), (37.733, 38.5), (38.5, 39.7), (39.7, 43.867), (43.867, 48.833)]","[('00:00:00.000', '00:00:03.967'), ('00:00:03.967', '00:00:04.567'), ('00:00:04.567', '00:00:05.833'), ('00:00:05.833', '00:00:11.600'), ('00:00:11.600', '00:00:20.400'), ('00:00:20.400', '00:00:22.233'), ('00:00:22.233', '00:00:24.400'), ('00:00:24.400', '00:00:25.733'), ('00:00:25.733', '00:00:26.867'), ('00:00:26.867', '00:00:28.600'), ('00:00:28.600', '00:00:30.533'), ('00:00:30.533', '00:00:35.833'), ('00:00:35.833', '00:00:37.733'), ('00:00:37.733', '00:00:38.500'), ('00:00:38.500', '00:00:39.700'), ('00:00:39.700', '00:00:43.867'), ('00:00:43.867', '00:00:48.833')]",0,17
results/pampersus/C-X4rNDMWji_2024-08-07_15-10-06_UTC_1, not to be dramatic but my life would not be the same without these new pampers free and gentle wipes everywhere in my house i am so excited to be partnering with pampers and as a mama of three one of my top parenting hacks is to have wipes in every room messes everywhere and these wipes clean better than huggies natural care and grip the mess so you're always ready whether it's cleaning up after a messy snack wiping off paint from an art project or tidying up after outdoor play these free and gentle wipes are my hero and we always stock up in bulk at heb life's messes are not a worry with pampers so make sure you make your life easier and stock up on our favorite wipes at heb and keep them all over that house of yours thank me later,False,True,False,False,False,True,True,False,False,True,False,False,False,False,False,False,False,False,False,False,False,False,False,False,False,False,False,False,False,False,False,False,False,False,False,False,False,False,False,False,False,False,False,False,False,False,False,False,False,False,False,43.26,4.68,False,False,False,False,False,False,False,False,False,False,False,False,False,1,17.43,0,1,0.0,0,"(0, 0)",1,0,"[(0.0, 6.786), (6.786, 8.929), (8.929, 13.429), (13.429, 14.714), (14.714, 17.643), (17.643, 20.143), (20.143, 21.893), (21.893, 24.071), (24.071, 24.857), (24.857, 25.643), (25.643, 26.607), (26.607, 28.107), (28.107, 30.107), (30.107, 31.321), (31.321, 32.179), (32.179, 32.643), (32.643, 33.143), (33.143, 33.821), (33.821, 34.464), (34.464, 35.75), (35.75, 36.357), (36.357, 38.25), (38.25, 39.5), (39.5, 40.179), (40.179, 42.429), (42.429, 43.179)]","[('00:00:00.000', '00:00:06.786'), ('00:00:06.786', '00:00:08.929'), ('00:00:08.929', '00:00:13.429'), ('00:00:13.429', '00:00:14.714'), ('00:00:14.714', '00:00:17.643'), ('00:00:17.643', '00:00:20.143'), ('00:00:20.143', '00:00:21.893'), ('00:00:21.893', '00:00:24.071'), ('00:00:24.071', '00:00:24.857'), ('00:00:24.857', '00:00:25.643'), ('00:00:25.643', '00:00:26.607'), ('00:00:26.607', '00:00:28.107'), ('00:00:28.107', '00:00:30.107'), ('00:00:30.107', '00:00:31.321'), ('00:00:31.321', '00:00:32.179'), ('00:00:32.179', '00:00:32.643'), ('00:00:32.643', '00:00:33.143'), ('00:00:33.143', '00:00:33.821'), ('00:00:33.821', '00:00:34.464'), ('00:00:34.464', '00:00:35.750'), ('00:00:35.750', '00:00:36.357'), ('00:00:36.357', '00:00:38.250'), ('00:00:38.250', '00:00:39.500'), ('00:00:39.500', '00:00:40.179'), ('00:00:40.179', '00:00:42.429'), ('00:00:42.429', '00:00:43.179')]",0,26
results/pampersus/C-nw4gyyYc__2024-08-13_19-12-00_UTC_1," Are you feeling nervous about potty training your toddler for the first time? I know I was. Which is why I got the new Pampers Easy Ups featuring my son's favorite, Bluey. This training underwear is so soft and comfortable. Plus with this adorable exclusive Bluey design, potty training has just got so much more fun. If you have a hyperactive toddler, you know exactly how important it is to have a training underwear you can actually rely on. These soft and comfy pants help your toddler feel like a big kid. And elastic waistband means they can pull it on and off all by themselves. My favorite part is, of course, up to 100% leak-proof protection overnight. If you're ready to make potty training stress-free and more fun, give Pampers Easy Ups a try. Your little ones would love it and you will really appreciate it.",False,True,True,False,False,True,True,True,True,False,False,False,False,False,False,False,False,True,False,False,False,False,False,False,False,False,False,False,False,False,False,False,False,False,False,False,False,False,False,False,False,False,False,False,False,False,False,False,False,False,False,39.17,4.12,False,False,False,False,False,False,False,False,False,False,False,False,False,0,0.0,0,0,0.0,0,"(0, 0)",1,0,"[(0.0, 4.3), (4.3, 8.267), (8.267, 10.833), (10.833, 16.5), (16.5, 18.733), (18.733, 19.533), (19.533, 20.567), (20.567, 21.733), (21.733, 24.667), (24.667, 26.1), (26.1, 27.467), (27.467, 28.7), (28.7, 30.133), (30.133, 31.5), (31.5, 36.133), (36.133, 39.067)]","[('00:00:00.000', '00:00:04.300'), ('00:00:04.300', '00:00:08.267'), ('00:00:08.267', '00:00:10.833'), ('00:00:10.833', '00:00:16.500'), ('00:00:16.500', '00:00:18.733'), ('00:00:18.733', '00:00:19.533'), ('00:00:19.533', '00:00:20.567'), ('00:00:20.567', '00:00:21.733'), ('00:00:21.733', '00:00:24.667'), ('00:00:24.667', '00:00:26.100'), ('00:00:26.100', '00:00:27.467'), ('00:00:27.467', '00:00:28.700'), ('00:00:28.700', '00:00:30.133'), ('00:00:30.133', '00:00:31.500'), ('00:00:31.500', '00:00:36.133'), ('00:00:36.133', '00:00:39.067')]",0,16
results/pampersus/C-qWekER-UE_2024-08-14_19-18-29_UTC_1," The perfect wipe didn't exist until now, you guys. I am so excited to be partnering with Pampers. As a toddler mom and currently pregnant, we are always on the go. It is seriously a non-negotiable for me to have reliable wipes in our diaper bag at all times. My daughter also has eczema, so we have to be really careful what we put on her skin. But Pampers Free and Gentle is 100% plant-based while containing 0% alcohols, dyes, or fragrances. Pampers Free and Gentle wipes clean better than the Huggies Natural Care and grip the mess. I'm so glad I found our new go-to wipes. You can pick up the new Pampers Free and Gentle wipes, which are available at Stop and Shop today.",False,True,False,False,False,True,True,False,False,True,True,False,True,False,False,False,False,True,False,False,False,False,False,False,False,False,False,False,False,False,False,False,False,False,False,False,False,False,False,False,False,False,False,False,False,False,False,False,False,False,False,31.37,2.24,False,False,False,False,False,False,False,False,False,False,False,False,False,1,23.14,0,0,9.579999999999998,0,"(21.240000000000002, 30.82)",1,0,"[(0.0, 1.833), (1.833, 3.467), (3.467, 4.433), (4.433, 5.7), (5.7, 6.6), (6.6, 7.667), (7.667, 9.833), (9.833, 11.2), (11.2, 12.467), (12.467, 14.4), (14.4, 15.9), (15.9, 16.867), (16.867, 17.7), (17.7, 18.833), (18.833, 20.033), (20.033, 21.433), (21.433, 25.367), (25.367, 27.533), (27.533, 28.967), (28.967, 31.267)]","[('00:00:00.000', '00:00:01.833'), ('00:00:01.833', '00:00:03.467'), ('00:00:03.467', '00:00:04.433'), ('00:00:04.433', '00:00:05.700'), ('00:00:05.700', '00:00:06.600'), ('00:00:06.600', '00:00:07.667'), ('00:00:07.667', '00:00:09.833'), ('00:00:09.833', '00:00:11.200'), ('00:00:11.200', '00:00:12.467'), ('00:00:12.467', '00:00:14.400'), ('00:00:14.400', '00:00:15.900'), ('00:00:15.900', '00:00:16.867'), ('00:00:16.867', '00:00:17.700'), ('00:00:17.700', '00:00:18.833'), ('00:00:18.833', '00:00:20.033'), ('00:00:20.033', '00:00:21.433'), ('00:00:21.433', '00:00:25.367'), ('00:00:25.367', '00:00:27.533'), ('00:00:27.533', '00:00:28.967'), ('00:00:28.967', '00:00:31.267')]",1,20
results/pampersus/C-sk0rlx3-A_2024-08-15_16-00-00_UTC," I'm a potty training mom. Of course I get so excited when my daughter goes in the potty. I'm a potty training mom. Of course I have a jar full of potty treats. I'm a potty training mom. Of course I have four different types of potties. I'm a potty training mom. Of course I ask, did you wipe? 6,000 times a day. I'm a potty training mom. Of course I drop everything when I hear the words, Mommy, I have to pee! I'm a potty training mom. Of course I use Pampers Easy Ups to avoid as many accidents as possible with our up to 100% leak-proof protection. This video was sponsored by Pampers Easy Ups.",False,True,False,False,False,True,True,False,False,False,False,False,False,False,False,False,False,True,False,False,False,False,False,False,False,False,False,False,False,False,False,False,False,False,False,False,False,False,False,False,False,False,False,False,False,False,False,False,False,False,False,41.24,6.0,False,False,False,False,False,False,False,False,False,False,False,False,False,0,0.0,0,0,0.0,0,"(0, 0)",1,0,"[(0.0, 5.933), (5.933, 9.767), (9.767, 14.667), (14.667, 20.0), (20.0, 20.733), (20.733, 28.567), (28.567, 37.267), (37.267, 41.133)]","[('00:00:00.000', '00:00:05.933'), ('00:00:05.933', '00:00:09.767'), ('00:00:09.767', '00:00:14.667'), ('00:00:14.667', '00:00:20.000'), ('00:00:20.000', '00:00:20.733'), ('00:00:20.733', '00:00:28.567'), ('00:00:28.567', '00:00:37.267'), ('00:00:37.267', '00:00:41.133')]",0,8
results/pampersus/C-vJ_tlOYRR_2024-08-16_16-05-40_UTC," Yay! Potty training ain't easy. Okay, I remember over 16 years ago with my oldest, Micah, we didn't have Pampers easy ups. So we just had to catch him at the right time. He would leave a trail of poop on the way there. With Pampers easy ups now, it's way easier. Potty training can be an adventure, even with a little help from Bluey. And it makes little Mike feel like he has a little buddy to go to the potty with him. Our mornings have been so much smoother. And not to mention, it provides up to 100% leak proof protection with the convenient look and feel of real underwear. And let me tell you, this has been a game changer. Tell mommy when you have to go bye poo poo. Thank you Pampers easy ups for partnering with us. Are you ready to make your potty training journey fun? An adventure with Bluey. Check the link in our bio for more information on Pampers easy ups featuring Bluey.",False,True,True,False,False,True,True,True,True,False,False,False,False,False,False,False,False,False,False,False,False,False,False,False,False,False,False,False,False,False,False,False,False,False,False,False,False,False,False,False,False,False,False,False,False,False,False,False,False,False,False,60.95,2.54,False,False,False,False,False,False,False,False,False,False,False,False,False,0,0.0,0,0,0.0,0,"(0, 0)",1,0,"[(0.0, 2.7), (2.7, 9.767), (9.767, 11.967), (11.967, 13.267), (13.267, 15.367), (15.367, 18.667), (18.667, 21.1), (21.1, 22.333), (22.333, 25.267), (25.267, 26.4), (26.4, 28.5), (28.5, 28.933), (28.933, 29.933), (29.933, 31.7), (31.7, 34.9), (34.9, 37.033), (37.033, 39.167), (39.167, 39.9), (39.9, 41.133), (41.133, 46.033), (46.033, 48.333), (48.333, 55.9), (55.9, 60.0), (60.0, 60.867)]","[('00:00:00.000', '00:00:02.700'), ('00:00:02.700', '00:00:09.767'), ('00:00:09.767', '00:00:11.967'), ('00:00:11.967', '00:00:13.267'), ('00:00:13.267', '00:00:15.367'), ('00:00:15.367', '00:00:18.667'), ('00:00:18.667', '00:00:21.100'), ('00:00:21.100', '00:00:22.333'), ('00:00:22.333', '00:00:25.267'), ('00:00:25.267', '00:00:26.400'), ('00:00:26.400', '00:00:28.500'), ('00:00:28.500', '00:00:28.933'), ('00:00:28.933', '00:00:29.933'), ('00:00:29.933', '00:00:31.700'), ('00:00:31.700', '00:00:34.900'), ('00:00:34.900', '00:00:37.033'), ('00:00:37.033', '00:00:39.167'), ('00:00:39.167', '00:00:39.900'), ('00:00:39.900', '00:00:41.133'), ('00:00:41.133', '00:00:46.033'), ('00:00:46.033', '00:00:48.333'), ('00:00:48.333', '00:00:55.900'), ('00:00:55.900', '00:01:00.000'), ('00:01:00.000', '00:01:00.867')]",0,24
